北府教幼字第1011259620三重0006號新北市私立哈佛園幼兒園,24fef8f8-97ea-4d1b-a102-f1ed9d4f6296
北府教幼字第1011259620三重0018號新北市私立益智幼兒園,7dd10969-9eca-470c-b6e4-25f205cf1791
北府教幼字第1011259620三重0014號新北市私立啟文幼兒園,d8042ceb-2ebe-4721-b5e7-fd361d1778eb
北府教幼字第1011259620三重0051號新北市私立華兒園精緻幼兒園,1bf70674-f432-44f9-b054-e0f995de88da
北府教幼字第1011259620三重0057號新北市私立上綸幼兒園,05836c61-7743-4587-af34-47fb426d94cd
北府教幼字第1011259620三重0025號新北市私立重新幼兒園,d3d18119-54fa-46b0-924c-422220743708
北府教幼字第1011259620三重0022號新北市私立夏綠蒂幼兒園,83cd8ff0-1463-496d-be98-7573ca4ce370
新北府教幼字第1072252285號新北市私立威妮斯特堡幼兒園,c10db83d-fa02-4973-aace-0fca86cb5339
北府教幼字第1011259620三重0049之1號新北市私立勁寶兒喜星園幼兒園,5cbbc708-6d5c-466e-939f-caacf2bdca59
北府教幼字第1011259620三重0050之1號新北市私立來來幼兒園,a6ab66ea-8bbc-49f6-84e9-ff3f7cfa79c1
北府教幼字第1011259620三重0058之1號新北市私立肯妮斯幼兒園,997b43ab-cdb7-4905-8026-7e52b0e5d3d8
新北府教幼字第1041548680三重0059之1號新北市私立天鵝園幼兒園,ed16d2b3-670a-454f-9ec1-fb8ecf616229
北府教幼字第1011259620三重0012號新北市私立長頸鹿吉凱幼兒園,e7071b50-ceec-44dd-8ea7-8472631c3360
北府教幼字第1011259620三重0062號新北市私立徠安幼兒園,bd024eb5-4ed3-48ef-9e63-8b743bb8f3e9
北府教幼字第1011259620三重0024號新北市私立仁慈幼兒園,51762c3e-6378-4f48-b21c-1ff11b646169
北府教幼字第1011259620三重0017號新北市私立碧華幼兒園,f7a821ab-3e5a-48bc-bab5-1450bb75846c
北府教幼字第1011259620三重0016之1號新北市私立三重忠孝幼兒園,131f7ce0-8226-4ceb-a412-3d8be943d4f7
北府教幼字第1011259620三重0020號新北市私立東光幼兒園,3755c6ec-d8b2-4b31-b041-58123f255b20
新北府教幼字第1080003599三重0015之2號新北市私立丹力幼兒園,0c77ddec-2329-4903-89ad-c0a3bbf41f46
北府教幼字第1011259620三重0063號新北市私立惠文幼兒園,74df6b44-a7ba-4318-aec8-0466a393fbc9
新北府教幼字第1080003599三重0053之4號新北市私立重愛幼兒園,ab216151-8d81-40d8-ac15-36a3e01b7c36
新北府教幼字第1080003599三重0098號新北市私立重愛幼兒園三民分班,f34a8c25-35e3-41a9-889a-88edc12ee6b4
新北府教幼字第1080003599三重0052之1號新北市私立新學林幼兒園,9567eb0b-f638-4cc1-836e-0d5bece7e7df
北府教幼字第1011259620三重0055號新北市私立鼎群幼兒園,8c45852f-0b40-4341-8cc9-1390da4876d6
北府教幼字第1011259620三重0064號新北市私立惠文兒童領袖幼兒園,dd17ca26-50f1-4758-abf8-6f2f16f44c1a
新北府教幼字第1041548680三重0047之1號新北市私立艾力克幼兒園,76dc701a-4c46-4ce6-a748-471686fe86b4
新北府教幼字第1080003599三重0056之1號財團法人天主教會台北教區附設新北市私立母心幼兒園,7ae6df38-9d94-4821-9dac-c8b23da5a25a
北府教幼字第1011259620三重0066之1號新北市私立復國幼兒園,2754276d-1ff2-4e75-9f81-6695de738418
北府教幼字第1011259620三重0065號新北市私立吉德幼兒園,7d8efc23-4d4f-4c86-acd8-8cc579875679
北府教幼字第1011259620三重0067號新北市私立喬大幼兒園,b90942c3-e766-4f79-8976-c97bc90eafca
新北府教幼字第1080003599三重0073之2號新北市私立英嘉幼兒園,130d35d4-6b73-4a4a-942f-5b6bf6f027f0
北府教幼字第1011259620三重0072號新北市私立甜甜幼兒園,f498bba4-6086-41ab-988c-b9a8b388e5bd
新北府教幼字字第1041548680三重0070之1號新北市私立愛箂兒幼兒園,934245b6-6578-4bdc-9ed6-98b561353049
北府教幼字第1011259620三重0071-1號新北市私立強森園幼兒園,84dec3bc-a585-4f77-98de-a1f74ed3b18d
北府教幼字第1011259620三重0077之1號新北市私立班博士幼兒園,0d50df65-ee81-462d-88ea-e9604da3fed6
北府教幼字第1011259620三重0074號新北市私立大全幼兒園,f00580b7-fe1d-445f-9ffa-20553a172def
北府教幼字第1011259620三重0075號新北市私立育林幼兒園,38c96456-339e-4944-90b4-aebdf938f412
北府教幼字第1011259620三重0021號新北市私立喜星園幼兒園,f3cd3b25-909e-477e-bf1e-038bf98fc186
北府教幼字第1011259620三重0010號新北市私立學仕幼兒園,60ff647e-9f81-40a8-8f7e-9aa54cac7dc8
北府教幼字第1011259620三重0078號新北市私立藤井樹幼兒園,ff47b1d1-7399-4b11-b7c5-8d35d449c27c
北府教幼字第1011259620三重0084號新北市私立艾美樂幼兒園,d6545095-8a02-469c-a129-98804aebfdcf
北府教幼字第1011259620三重0082號新北市私立宜德幼兒園,135cf610-4b12-4d39-a571-14348cb1634c
北府教幼字第1011259620三重0080號新北市私立英群幼兒園,e7a7d3c8-4780-4dee-94aa-3f1674ad79cd
北府教幼字第1011259620三重0079號新北市私立兒童天地幼兒園,c4b87fe7-b6c3-4906-8031-aafc1b726275
北府教幼字第1011259620三重0083號新北市私立吉的堡英資幼兒園,fb56026e-18c8-4ac0-9855-ad8e53c04be9
北府教幼字第1011259620三重0087號新北市私立三和幼兒園,ebeeff50-09ba-429d-a0e6-36fcca4297b7
北府教幼字第1011259620三重0081號新北市私立吉的堡英群幼兒園,bf8de8de-52ab-4528-86e8-998d325d2c90
北府教幼字第1011259620三重0085號新北市私立茱莉亞園幼兒園,a33d7769-25d9-41a2-affb-dbcad3bdd3a9
北府教幼字第1011259620三重0085號新北市私立新永福幼兒園,06e366dd-480f-4c0b-86ba-eb292df929c6
新北府教幼字第1080003599三重0088之1號新北市私立華納幼兒園,211006e2-837b-4ffd-ac91-4a30e921b085
北府教幼字第1011259620三重0090號新北市私立子禕天地幼兒園,bd61936d-35c2-4880-83f8-4644fdca0860
北府教幼字第1011259620三重0092號新北市私立新二重幼兒園,89def7f5-8972-4056-ab86-2bce5b5e6a3c
新北府教幼字第1041548680三重0094號新北市私立翊華三重國際幼兒園,bf3d5323-2596-4608-8e5d-f8d7f13f48e2
新北府教幼字第1080003599三重0096號新北市私立加州森林國際幼兒園,7a89194c-c69a-4b41-95cb-27799863653c
新北府教幼字第1080003599三重0097號新北市私立宇和幼兒園,0c506ddb-4eb9-4d8f-b31d-b956dbaaf3b6
新北府教幼字第1080003599三重0100號新北市私立金吉邇幼兒園,97320624-d2b0-489c-93c0-9f74f783af46
新北府教幼字第1080003599三重0099號新北市碧城非營利幼兒園(委託社團法人中華音樂舞蹈暨表演藝術教育協會辦理),dfe33fb7-a85f-49e0-97e2-458db82b2df7
新北府教幼字第1080003599新莊0057之6號新北市新莊區中港國民小學附設幼兒園,fe8e739a-b6bd-42b6-94d0-10b473c70f3a
新北府教幼字第1080003599新莊0039之5號新北市新莊區昌隆國民小學附設幼兒園,c2dd01f1-5940-41d0-8b21-6f3a348b4e3b
新北府教幼字第1080003599新莊0037之3號新北市新莊區民安國民小學附設幼兒園,e5bccc29-be9c-4905-9761-2baae56e319d
新北府教幼字第1080003599新莊0041之4號新北市新莊區國泰國民小學附設幼兒園,3d124323-b77e-4c6f-84d1-022b345007dd
新北府教幼字第1080003599新莊0036之3號新北市新莊區丹鳳國民小學附設幼兒園,7a045f7d-9fd9-4869-a3bf-e6f8d4d24e62
新北府教幼字第1080003599新莊0054之3號新北市新莊區頭前國民小學附設幼兒園,3ee45fe7-413a-4bec-b938-786be73f75ee
新北府教幼字第1041548680新莊0050之3號新北市新莊區新莊國民小學附設幼兒園,0c756e37-94fb-4fac-b532-37953641a384
新北府教幼字第1041548680新莊0040之4號新北市新莊區思賢國民小學附設幼兒園,d9f5480a-24bc-44bf-bbef-c5f78aa32e08
新北府教幼字第1080003599新莊0051之2號新北市新莊區裕民國民小學附設幼兒園,6c89a69e-af7a-42e3-9d55-fead9fa61699
新北府教幼字第1080003599新莊0044之2號新北市立新莊幼兒園,57fa89ca-a0ba-4dc6-80f1-ab6cf85fdfd6
新北府教幼字第1080003599新莊046之2號新北市立新莊幼兒園中心分班,404d2966-663a-4e8c-8d65-1810d3e944ce
新北府教幼字第1080003599新莊045之2號新北市立新莊幼兒園三合分班,827dedcf-299d-4a83-a08c-f6623cd84f59
新北府教幼字第1080003599新莊0042之2號新北市新莊區新泰國民小學附設幼兒園,a14a9fdd-8da8-4b05-8eb5-8297130ad46d
新北府教幼字第1041548680新莊0052之2號新北市新莊區榮富國民小學附設幼兒園,d7f8145b-81c0-45a0-955f-ba5ea3f95354
新北府教幼字第1080003599新莊0035之2號新北市新莊區中信國民小學附設幼兒園,2bf5ccee-d543-4cbe-b6fd-daf08c1bf7a9
新北府教幼字第1080003599新莊0053之3號新北市新莊區興化國民小學附設幼兒園,b3340996-bdfb-4398-8eec-0640e7cc1001
新北府教幼字第1080003599新莊0056之4號新北市新莊區豐年國民小學附設幼兒園,bfe0145b-717e-4d0a-abca-096ad356fbf3
新北府教幼字第1080003599新莊0038之1號新北市新莊區光華國民小學附設幼兒園,2bbeb328-66ea-4f68-85bd-d806148bd95f
新北府教幼字第1080003599新莊0055之2號新北市立頭前國民中學附設幼兒園,3385550b-ae53-46f0-870e-72b8caca005a
新北府教幼字第1080003599新莊0043之4號新北市立新泰國民中學附設幼兒園,f33302f4-b904-4801-aac9-09893c7734bd
新北府教幼字第1080003599新莊0003之1號新北市私立安安幼兒園,2dbe4bf8-9111-4c45-8942-5f3e6b5e3954
北府教幼字第1011259620新莊0002號新北市私立維尼芽幼兒園,7edc91b8-0641-46a8-bdca-55b6227c4bdc
北府教幼字第1011259620新莊0040之1號新北市私立太陽花幼兒園,2aa9e54f-2b5d-4271-bfce-3da63480a1b7
北府教幼字第1011259620新莊0011號新北市私立思源幼兒園,5cf641e0-f9cc-4fe4-b176-98d07c4c2730
北府教幼字第1011259620新莊0014號新北市私立吉尼爾幼兒園,2a22a5c4-532d-439f-b68b-b454ffa94949
北府教幼字第1011259620新莊0008號新北市私立生活家幼兒園,f6b9d0a9-60ca-4534-80b9-4ea657d58543
北府教幼字第1011259620新莊0006號新北市私立悠幼幼兒園,61054a80-a32e-4124-9e84-64cb24a943b4
北府教幼字第1011259620新莊0009號新北市私立超級小太陽幼兒園,ade1b418-6c83-4297-b891-cede62e820af
北府教幼字第1011259620新莊0007號新北市私立和智幼兒園,f866e441-bee3-4894-85bb-403bb13b33a8
新北府教幼字第1080003599新莊0010之1號財團法人天主教會台北教區附設新北市私立鳴遠幼兒園,6346023f-5ad6-46dc-b81a-78bcf98fffdb
北府教幼字第1011259620新莊0012之1號新北市私立親親袋鼠幼兒園,1aeb1b0d-48c7-49d0-80d9-554ba10c1a95
新北府教幼字第1041548680新莊0013之1號新北市私立傑安幼兒園,792eb71e-c7cf-4b24-ad9b-98beceb1df83
北府教幼字第1011259620新莊0029號新北市私立愛蜜立幼兒園,fea3ddd6-221b-49ca-bb49-6880c7c41d6f
新北府教幼字第1041548680新莊0016之1號建豐建設股份有限公司附設新北市私立卡爾維德幼兒園,9fa21372-dfd4-4195-9939-f9838a7ec359
北府教幼字第1011259620新莊0015號新北市私立大世紀幼兒園,ee1db239-95e8-4509-8cbb-11ef60a95692
新北府教幼字第1080003599新莊0021之1號新北市私立晨光幼兒園,721a03dc-2f6f-42ea-b46f-842e7bfb3551
北府教幼字第1011259620新莊0001號新北市私立新榮富新莊幼兒園,57db5735-a7e7-4cea-8a18-63fb6a35169f
北府教幼字第1011259620新莊0030號新北市私立何嘉仁昌隆幼兒園,6b6152ad-99b3-49c5-9296-a4bd0107d589
北府教幼字第1011259620新莊0028號新北市私立勵輝國際幼兒園,3bbf8a2b-27c5-4383-80be-94b8a937d203
北府教幼字第1011259620新莊0027號新北市私立永錡裕民幼兒園,5df108e3-1f77-42be-bbbc-e588d225e968
北府教幼字第1011259620新莊0098號新北市私立何嘉仁幼兒園,0bdb1178-783e-4c1d-88d4-bf629d4a2852
北府教幼字第1011259620新莊0018號新北市私立勵輝幼兒園,7051510f-adcb-4102-8d9e-519c27e307a8
北府教幼字第1011259620新莊0068號新北市私立傑瑞兒童村幼兒園,70bf8bcd-486f-4c0f-9129-251ce89be091
北府教幼字第1011259620新莊0031號新北市私立榮欣幼兒園,14fb4d1a-738c-4c97-9829-2d98bb5bfe37
北府教幼字第1011259620新莊0099號新北市私立新榮富幼兒園,64a0b98d-74c8-4981-8b23-41f1afd581b5
北府教幼字第1011259620新莊0102號新北市私立塏地安幼兒園,4d48a511-d0e6-45e4-86ba-4d800531c7d6
新北府教幼字第1041548680新莊0025之1號新北市私立文笙幼兒園,543b91a6-3d80-4fe2-9273-d42ba92b43fe
北府教幼字第1011259620新莊0026號新北市私立建和幼兒園,11f7ba32-ceeb-4e4f-a101-8dee6f9c35ee
新北府教幼字第1041548680新莊0079之1號新北市私立民生幼兒園,a4a2f21d-fcaf-4d5c-bde3-149c18f95955
北府教幼字第1011259620新莊0070號新北市私立凱達格蘭幼兒園,374c62cc-c4af-48b3-8d45-a06de44a204f
新北府教幼字第1041548680新莊0020之2號新北市私立惠文小熊森林幼兒園,ae5ccfc7-a947-40ff-a720-539df8d06a35
北府教幼字第1011259620新莊0023號新北市私立喬聖幼兒園,bb9ce49e-428c-40b2-ada8-4a5c6798ce8e
北府教幼字第1011259620新莊0034之1號新北市私立惠群幼兒園,11aac97d-ba70-4e33-8d78-1093f5d9cf98
北府教幼字第1011259620新莊0100號新北市私立寧馨園幼兒園,b0100f5c-fd88-4f05-991b-80cfd2d63bde
新北府教幼字第1041548680新莊0104之2號新北市私立傑出幼兒園,9b381e64-ea03-42cb-8474-cc5f4b068a1d
新北府教幼字第1041548680新莊0105之2號新北市私立僑治亞頭前幼兒園,c2be30fb-ba8e-4053-8a6b-a8ebe2f693ab
新北府教幼字第1080003599新莊0071之1號新北市私立捷群幼兒園,6e0ea08e-661f-4c9d-85fc-b82931a992eb
新北府教幼字第1080003599新莊0032之1號新北市私立永錡光華幼兒園,cfc12ddb-f8d7-4e76-95dd-3beb2627ad69
北府教幼字第1011259620新莊0069號新北市私立幼愛幼兒園,1dc12f64-2a96-458c-a4e9-4c6cd9ec274c
北府教幼字第1011259620新莊0084之1號新北市私立欣園幼兒園,0f57fead-e491-4569-8eb1-83341a6df287
北府教幼字第1011259620新莊0075號新北市私立榮富幼兒園,ea368fd3-bcc4-44e9-b382-4989cf389632
新北府教幼字第1080003599新莊0091之1號新北市私立意秋幼兒園,a9fd6811-c11c-4501-9255-dea9a26e0ca3
新北府教幼字第1041548680新莊0060之1號新北市私立格登幼兒園,862cc998-efb8-41c7-a119-97fee0c76edc
北府教幼字第1011259620新莊0095之1號新北市私立慷乃兒幼兒園,87ac6735-28c9-4597-930b-e7d45674c802
北府教幼字第1011259620新莊0078號新北市私立育誠幼兒園,2cd10247-28de-45c6-a6aa-1266d8d6ba52
北府教幼字第1011259620新莊0106號新北市私立青園幼兒園,7a6ad621-a452-40bc-a971-09b93f01ee6a
北府教幼字第1011259620新莊0074號新北市私立永松幼兒園,3cbbaa70-6a5b-46d3-8f35-9b1a278b9021
新北府教幼字第1041548680新莊0072之2號新北市私立千暉幼兒園,e581af36-7a75-43ee-a980-4113715d0c03
新北府教幼字第1080003599新莊0076之1號新北市私立夏恩昌隆幼兒園,76b025d1-3a8d-4e20-902f-d5b660804c50
北府教幼字第1011259620新莊0086號新北市私立健群幼兒園,9cbdf581-4c71-4ce1-8dd0-b72e1585dba8
新北府教幼字第1080003599新莊0062之1號天億文教事業股份有限公司附設新北市私立皇家幼兒園,75332d54-be2b-4526-b8f5-664a89da1078
北府教幼字第1011259620新莊0063之1號新北市私立奇異鳥幼兒園,cd825bc8-2871-4a90-a6e3-a092d34ac42c
北府教幼字第1011259620新莊0085之1號新北市私立宏仁幼兒園,ad7ef1f5-4986-433f-a971-597e7a8c29aa
北府教幼字第1011259620新莊0067號新北市私立心慈幼兒園,9c2ca516-0873-41f6-939b-1d8d50aa9f35
新北府教幼字第1080003599新莊0059之1號新北市私立育全幼兒園,304555dc-0298-435e-95c1-dab30a9f6d0b
北府教幼字第1011259620新莊0082號新北市私立僑治亞幼兒園,73764d5b-7e05-4a49-b0d6-36397d72fa43
新北府教幼字第1041548680新莊0126號新北市私立僑治亞幼兒園中港分班,61ff5d3f-631b-4ffa-b3f5-a592c6a295db
新北府教幼字第1041548680新莊0077之1號新北市私立成德幼兒園,ceee7546-505f-4c16-b576-b796ab770cc1
北府教幼字第1011259620新莊0097號新北市私立惠文領袖幼兒園,bbc215f7-a63a-413d-a3fb-8d6d08c89cfa
北府教幼字第1011259620新莊0115號新北市私立尼爾生幼兒園,36c1f7c1-fb02-48f3-941d-61154aa4025b
新北府教幼字第1080003599新莊0081之2號新北市私立成功幼兒園,41e1cf5c-4fb8-4789-a791-af925567dee1
北府教幼字第1011259620新莊0096號新北市私立杜克幼兒園,f8e8b0af-f718-497e-b604-c9ae907cf6f4
北府教幼字第1011259620新莊0094號輔仁大學學校財團法人輔仁大學附設新北市私立幼兒園,8c52c0eb-a094-4950-93ea-8a2984e281c0
北府教幼字第1011259620新莊0061號新北市私立育誠中榮幼兒園,3396d2bc-2588-406e-9beb-43ede03d96f2
北府教幼字第1011259620新莊0093號新北市私立永錡幼兒園,fd466d95-3594-4897-85b1-9175b43d3348
新北府教幼字第1080003599新莊0087之2號新北市私立勁寶兒晨星園幼兒園,2e26cd81-206d-4a4f-85a2-2b516d11676d
北府教幼字第1011259620新莊0092號新北市私立文理幼兒園,cad6a2c0-9de9-40d1-9997-bba61371e027
新北府教幼字第1100476616號財團法人天主教會台北教區附設新北市私立恆毅幼兒園,9ff66df9-136b-4249-9857-e96e902d972f
北府教幼字第1011259620新莊0058號新北市私立新育幼幼兒園,39eb94bb-6061-40c2-853d-64cc5cbd1c23
北府教幼字第1011259620新莊0107號新北市私立妙博士幼兒園,3cf2caec-cbce-4a2d-bc44-971e11ec758b
新北府教幼字第1080003599新莊0090之4號新北市私立福華幼兒園,ae3830b7-1c71-4e21-a4a2-f9d667873594
北府教幼字第1011259620新莊0073號新北市私立儒林幼兒園,36de5e6f-85ae-402a-af0a-b601d517e48d
北府教幼字第1011259620新莊0110號新北市私立及人幼兒園,694de2db-d20f-4fdc-9de3-d6da2603f574
北府教幼字第1011259620新莊0112號新北市私立惠園幼兒園,939cfcd8-07d6-48db-af1b-e86ea2f9922a
北府教幼字第1011259620新莊0109號新北市私立楷模幼兒園,da2e53e7-0007-4af5-ae2c-2c8493e9810b
新北府教幼字第1080003599新莊0108之1號新北市私立大鵬鳥幼兒園,8c9f81b6-9984-41b7-9430-5121ba2c0fd0
北府教幼字第1011259620新莊0119號新北市私立互仁幼兒園,f87606c5-fac7-4313-a61b-ecaa05f5dedf
北府教幼字第1011259620新莊0111號新北市私立寶貝家族幼兒園,334d64c6-33f6-4e04-b6e9-431323bef7d8
北府教幼字第1011259620新莊0122號新北市私立民安幼兒園,ab77f820-8816-4b86-b0f4-88f8843c7c4b
北府教幼字第1011259620新莊0113號新北市私立蓮育幼兒園,9b6342d9-1181-4c56-afa1-20e0510c56ce
北府教幼字第1011259620新莊0124號新北市私立永錡新莊幼兒園,eadf04f8-4024-4cf4-be6f-34f81e567a57
新北府教幼字第1080003599新莊0125之1號新北市私立英勝幼兒園,b98d8566-1e27-4237-b056-0f1d1a78be8b
新北府教幼字第1041548680新莊0128號新北市私立成德菁英幼兒園,a2f55b05-29a6-429c-86e4-c6d0d7d386b7
新北府教幼字第1080003599新莊0130之1號社團法人新竹市教保人員協會附設新北市私立新莊聯合幼兒園,13b5ae47-69e7-48e4-8122-8feea339718f
新北府教幼字第1080003599新莊0132號新北市私立育勝幼兒園,99543d81-20b2-4756-bcab-dba1b5131588
新北府教幼字第1080003599新莊0127之1號新北市昌平非營利幼兒園（委託財團法人三之三生命教育基金會辦理）,a3ec15ec-696c-44e0-a3a7-5bd00f9367d0
新北府教幼字第1080003599新莊0129之1號新北市中平非營利幼兒園(委託社團法人新北市中華國際嬰幼兒發展學會辦理),58201a07-45a6-4f92-be0d-6632eeac40b8
新北府教幼字字第1080003599新莊0131之1號新北市福營非營利幼兒園(委託社團法人中華兆陽文教發展協會辦理),5df04961-86d7-44c3-b032-b519e13bf12a
新北府教幼字第1080003599新莊0133號新北市新樂非營利幼兒園(委託財團法人三之三生命教育基金會辦理),98dd921a-95e8-45dd-b69b-64361caa7599
新北府教幼字第1080003599泰山0004之3號新北市泰山區同榮國民小學附設幼兒園,d762d248-7a5e-4d1e-9959-cf3e2cf6c887
新北府教幼字第1080003599泰山0005之2號新北市立泰山國民中學附設幼兒園,1a4557fa-c0f2-42d3-86da-37fd98c5fab3
新北府教幼字第1080003599泰山0002之4號新北市泰山區明志國民小學附設幼兒園,2448cb68-ae77-4262-855f-e7e6e155712c
新北府教幼字第1080003599泰山0003之5號新北市泰山區泰山國民小學附設幼兒園,0eef4e54-3212-4c41-9e24-c537ef192d70
新北府教幼字第1080003599泰山0006之3號新北市立泰山幼兒園,bf9bb898-e3df-4423-8008-1197b633af7b
新北府教幼字第1080003599泰山0007之1號新北市立泰山幼兒園明志分班,813cf136-6759-4528-afc6-bbac6a57636f
新北府教幼字第1080003599泰山0008之2號新北市立泰山幼兒園貴和分班,4a4008f9-dc4c-401f-8a0d-a0ee8f3c14e6
北府教幼字第1011259620泰山0001號財團法人天主教瑪利亞方濟各傳教女修會附設新北市私立曉明幼兒園,0206afa6-30a0-4c84-ab75-7517cd9c17c6
北府教幼字第1011259620泰山0009號新北市私立育榕幼兒園,c6db2a95-d811-4817-b84e-749790135b09
北府教幼字第1011259620泰山0012號新北市私立喬安幼兒園,c5d3b7c8-5e4d-461f-b8e8-cfe9332d8b68
北府教幼字第1011259620泰山0011號新北市私立晴幼幼兒園,c3774dae-b8ac-4760-9630-f2d78c586b74
北府教幼字第1011259620泰山0016之1號新北市私立泰山慈惠幼兒園,4427290e-4d85-48e4-abb5-f9e1d3b5468a
北府教幼字第1011259620泰山0013之1號新北市私立心翔幼兒園,dc3c9d37-b4f4-4531-b50c-59ce65120b5c
新北府教幼字第1080003599泰山0017之1號新北市私立振德幼兒園,21347c16-766e-4d46-a74b-d099488ce0d6
北府教幼字第1011259620泰山0019號財團法人臺灣省天主教道明傳教修女會附設新北市私立道明幼兒園,15ab21b9-e681-43d9-941b-a06a3726c398
北府教幼字第1011259620泰山0023號新北市私立青樺幼兒園,c2bc6947-8dcb-4949-95e4-7454856f768b
新北府教幼字第泰山0018之2號新北市私立華菂幼兒園,86bbb86c-b24e-43a3-b4e6-ef09671cdfd6
北府教幼字第1011259620泰山0025號新北市私立及幼幼兒園,8ae6976c-37c4-47cb-9c56-8d1cdec82fa1
北府教幼字第1011259620泰山0022號新北市私立比佛利幼兒園,ffc4bf34-7c35-439c-ae9c-8c064ba5a2ab
新北府教幼字第1041548680泰山0026之1號新北市私立比陽幼兒園,429c5a73-1630-4d63-bf17-934713a8202a
新北府教幼字第1041548680泰山0027號新北市私立新仁愛幼兒園,176614a5-6766-4db1-812c-4497e114a1ab
新北府教幼字第1080003599泰山0028號新北市私立夢不落幼兒園,3ccc71a2-183d-4699-955e-08b1ff4efb3d
新北府教幼字第1080003599林口0005之2號新北市林口區麗林國民小學附設幼兒園,097d4932-435e-484a-8e39-351017c3f667
新北府教幼字第1080003599林口0003之3號新北市林口區麗園國民小學附設幼兒園,e8291677-97a8-4410-8e9b-1c82144a180c
新北府教幼字第1041548680林口0002之3號新北市林口區南勢國民小學附設幼兒園,bb80c01b-b0c9-4225-bfaf-1ff10ad2b82c
新北府教幼字第1051548680林口0003之2號新北市林口區林口國民小學附設幼兒園,75a30144-e598-4684-996b-ba5fea9e1096
新北府教幼字第1080003599林口0008之3號新北市林口區頭湖國民小學附設幼兒園,0b18d748-fc34-495f-820b-80c97f99f756
北府教幼字第1011259620林口0007之1號新北市林口區瑞平國民小學附設幼兒園,cafd3a62-6083-4864-b074-9a8b3792ee3a
新北府教幼字第1080003599林口0009之3號新北市林口區興福國民小學附設幼兒園,402f7507-3aca-4c3d-913c-71648f2127ba
新北府教幼字第1080003599林口0006之3號新北市立崇林國民中學附設幼兒園,6cfb0fc7-8420-4563-9f26-f746d05c510c
新北府教幼字第1080003599林口0010之3號新北市立林口幼兒園,a07a496e-ee97-4a5d-8b66-7062910f3dce
新北府教幼字第1041548680林口0012之1號新北市立林口幼兒園湖北分班,21a24ff7-584f-4b1d-9378-87976ec68ef3
新北府教幼字第1041548680林口0011之2號新北市立林口幼兒園忠孝分班,95eb6c52-42e7-4fae-b8f3-0ce76dd3c6c8
新北府教幼字第1080003599林口0013之2號新北市林口區嘉寶國民小學附設幼兒園,18eda382-e1ad-4d79-8bbb-f85aa3609387
北府教幼字第1011259620林口0001號新北市私立林口幼兒園,faf1a89b-d4ce-4cc2-a331-4b7be7b3ba09
新北府教幼字第1041548680林口0026之1號新北市私立愛林幼兒園,d74dda2b-213b-49d8-bbc9-39c37395edd7
北府教幼字第1011259620林口0024號新北市私立吉而堡幼兒園,24173fbf-513d-4937-b6f8-5aa8d98a68b8
北府教幼字第1011259620林口0018號新北市私立林口愛丁堡幼兒園,b73b224d-b0fc-4798-815e-5eb3277e5993
新北府教幼字第1080003599林口0021之2號新北市私立千愛幼兒園,43e6455b-1620-40c2-840d-5005980bfd37
北府教幼字第1011259620林口0027之1號新北市私立智盛幼兒園,57495d7c-e86e-4468-bf2a-1b552f87d36a
北府教幼字第1011259620林口0019號新北市私立翔祥幼兒園,d9f14a26-3513-4507-ac74-8afe42dd29bc
北府教幼字第1011259620林口0030號新北市私立心兒園幼兒園,f2b0aa2b-5f97-4adf-b8f1-60a938e70815
北府教幼字第1011259620林口0029號新北市私立愛霖幼兒園,6c6e9735-1c8b-4260-8b4d-567d4d26bac4
北府教幼字第1011259620林口0022號新北市私立文達幼兒園,70c642c9-2bcb-4848-bdae-be336babcbe0
北府教幼字第1011259620林口0032號新北市私立心語幼兒園,be2e9ff0-d6f8-4271-b575-c82c7e1240b8
新北府教幼字第1041798038號新北市私立愛林城堡幼兒園,e0ee7859-8df5-4f94-8303-54f2d91514a4
新北府教幼字第1080003599林口0023之1號新北市私立林口啟文幼兒園,22adff3d-3807-4663-ba69-023f24039731
新北府教幼字第1080003599林口0035之1號奇異林股份有限公司附設新北市私立奇異鳥麗林幼兒園,cb28d4c8-9c76-4c63-8c77-380d27a2a7e5
北府教幼字第1011259620林口0016號新北市私立南蒂亞幼兒園,ea87cca2-58c3-4b76-be17-f9c040c90ec0
