中市教幼字第1110004621號臺中市立神岡幼兒園新庄分班,f91ed083-2292-4e44-ac83-a84b29be7845
中市教幼字第1080069462號臺中市立神岡幼兒園北庄分班,553bbd73-833f-4d3e-a7f5-49d878e52b06
中市教幼字第1010058274號臺中市立神岡幼兒園豐洲分班,f41a6e8b-d640-4268-a5f6-3947084aea14
中市字第1030040725號臺中市立神岡幼兒園三角分班,c1a1d5d6-7560-44b7-94f4-062b10e6cab1
中市教幼字第1070068569號臺中市神岡區豐洲國民小學附設幼兒園,f302f8b7-cf6c-42fe-84e9-fd8e9f0820c3
中市教幼字第1090028135號臺中市私立一安堂幼兒園,e4e0f182-b178-4424-ac94-1e75fa36d2ee
中市教幼字第1070011428號臺中市私立神岡三采幼兒園,1a68f4f5-877e-443c-a61e-dbfb888ac838
中市教幼字第1010026481號臺中市私立巧雅幼兒園,56424262-b7c8-462c-94b7-ccb8312cd4b4
中市教幼字第1040064607號臺中市私立保貝兒幼兒園,0ee3af45-2458-4d3f-9761-2ad3b542b373
中市教幼字第1010035570號臺中市私立佳音幼兒園,14ff39fa-908f-451b-8020-a5e63fa624fb
中市教幼字第1010026472號臺中市私立立人幼兒園,ddd67221-36f6-4b3b-9eaf-2b10d8c11ead
中市教幼字第1030006422號臺中市私立維笙幼兒園,2471f44d-33e8-49bb-a3cc-f4ef1a6ad5d6
中市教幼字第1050000754號臺中市私立神岡愛兒堡幼兒園,2bd37b0f-5537-4053-92e3-b62b274b2c07
中市教幼字第1070037393號臺中市私立神岡諾貝爾幼兒園,c18ad6e3-48f4-4d52-b9d5-0111cc544620
中市教幼字第1080118056號臺中市私立文惠幼兒園,1dde52e1-472a-41e9-97a8-db1c83b4f750
中市教幼字第1080083589號臺中市私立瀚林幼兒園,571fe922-9f76-44ed-b355-c9ee54753a6e
中市教幼字第1050529920號臺中市私立一心幼兒園,f2bfc503-7b23-433f-9569-cbdcd618c087
中市教幼字第1010036365號臺中市私立百科學幼兒園,bc5c3321-98e6-4a0d-8867-7dae5843b4b6
中市教幼字第1050049658號臺中市私立幼任幼兒園,49ad5fd2-c408-4e3c-ad10-9e773b7e42af
中市教幼字第1010034442號臺中市私立貝多芬幼兒園,0970dcd4-720b-4304-ac2c-64746ca72004
中市教幼字第1070088674號臺中市星光教育發展協會附設臺中市私立星光國際幼兒園,d2ffb6af-1bd1-44e7-a7f0-c043eb758a1a
中市教幼字第1060076283號臺中市大肚區山陽國民小學附設幼兒園,ecf2b350-7e89-46de-b170-f7ae6b8ed32a
中市教幼字第1050063501號臺中市大肚區追分國民小學附設幼兒園,49c6e6e1-385b-401a-82ea-d56ef54d10d4
中市教幼字第1110021714號臺中市立大肚幼兒園,030ebf80-e950-4389-86b6-8c75298ba3fd
中市教幼字第1040056780號臺中市立大肚幼兒園瑞井分班,9e3d60e3-a6ec-4c64-81f4-3fc02a8ba4d7
中市教幼字第1090072780號臺中市大肚區大忠國民小學附設幼兒園,efdfc6bf-1c21-4de9-956e-265f0e9d6a93
中市教幼字第1090071150號臺中市大肚區瑞井國民小學附設幼兒園,917c9bf8-f821-4297-a80b-4da00713bc14
中市教幼字第1080073530號臺中市大肚區永順國民小學附設幼兒園,343766cd-0f89-472e-a02b-954565eeb806
中市教幼字第1100057623號臺中市大肚區瑞峰國民小學附設幼兒園,110fff2a-02ed-4728-b8e0-27028ced0140
中市教幼字第1010019983號臺中市私立東森幼兒園,65a0eb16-878d-4b28-bbb2-5bff789240f6
中市教幼字第1040034615號臺中市私立明星幼兒園,f387a52e-99e6-4a42-bfac-4f894f9dbdd6
中市教幼字第1110000883號臺中市私立皇冠幼兒園,5a3b4936-337c-4d04-b2b9-3b6e9a14f345
中市教幼字第1010024296號臺中市私立愛德華幼兒園,c44bcdf7-9e0d-4872-893b-c68f94fc769c
中市教幼字第1090065106號臺中市私立賞識幼兒園,099faabd-1b0f-4a52-9b01-e27e77a7547e
中市教幼字第1010022751號臺中市私立龍鳳兒幼兒園,d4c97a3e-62ae-49f0-8746-cf2b3c9f4022
中市教幼字第1020059056號臺中市私立天祥幼兒園,6c122a02-4d86-44a0-a441-f5c2927acabe
中市教幼字第1010024334號臺中市私立培英幼兒園,73d35bb6-19c6-433b-bea0-e7cf8736569b
中市教幼字第1060006588號臺中市私立綠拇指幼兒園,20b3ccb2-c2e7-494f-8b43-28f3473cf0df
中市教幼字第1100044921號臺中市私立育成幼兒園,e3e4388d-a7e8-49c1-845c-07a2a33e5560
中市教幼字第1100058849號臺中市沙鹿區公明國民小學附設幼兒園,9d8a9618-0f86-4d22-a7d6-cd95c10e21f0
中市教幼字第100068561號臺中市沙鹿區竹林國民小學附設幼兒園,cfe42192-d07f-4482-a99b-c0b49e4c42dc
中市教幼字第1080072131號臺中市沙鹿區鹿峰國民小學附設幼兒園,a5b6f5ff-7382-41c4-bcfd-ab87fef1cff7
中市教幼字第1070067734號臺中市沙鹿區北勢國民小學附設幼兒園,220e67e1-4e0a-4133-9f30-79eb91b59aa0
中市教幼字第1040064332號臺中市沙鹿區沙鹿國民小學附設幼兒園,d0984a32-f696-4781-9938-e00656c013f1
中市教幼字第1040039927號臺中市立沙鹿幼兒園,3348abd8-9fdd-4ed7-af8d-3355e03494ac
中市教幼字第10100705133號臺中市立沙鹿幼兒園竹林分班,4fb65cc2-c316-41a1-8ced-c6c4ce7e2083
中市教幼字第1070096529號臺中市立沙鹿幼兒園樂群分班,1fc7f94d-b0a7-491e-9921-8eb74ef8d601
中市教幼字第10400399273號臺中市立沙鹿幼兒園福興分班,f7d7bd98-a1e9-4d24-8e33-2543173e7dac
中市教幼字第10400399272號臺中市立沙鹿幼兒園晉江分班,b1eccffd-353c-42cc-a34c-e8d86baae00a
中市教幼字第10100705137號臺中市立沙鹿幼兒園埔子分班,d1db2ae9-1c95-40a9-9058-e74969bcbfb0
中市教幼字第1100058983號臺中市沙鹿區公舘國民小學附設幼兒園,c958306b-7181-47f4-b65c-5d54a4d8a70c
中市教幼字第1060021947號私立弘光科技大學附設臺中市幼兒園,54fbec48-9fdf-4c18-b8fc-55dd15d15b73
中市教幼字第1060021943號私立弘光科技大學附設臺中市中棲幼兒園,ba3b6784-0399-4aa3-8d3d-d8d47eade5bb
中市教幼字第1050033591號臺中市私立文森幼兒園,73a6bb7d-d1e5-41ab-a70b-856ae69afd0f
中市教幼字第1050103059號臺中市私立新欣園幼兒園,61eeee62-ea6a-4fe9-ac03-72f9451c9211
中市教幼字第1010033444號臺中市私立米奇兒幼兒園,b4a18574-3861-416e-a52d-618b578b9862
中市教幼字第1010033617號臺中市私立沙鹿瑪歇爾幼兒園,1611c848-16c0-4169-bb59-a8a2855d35d3
中市教幼字第1010032496號臺中市私立尚恩幼兒園,9ae77a94-afe1-44b8-9198-db469b19fc2b
中市教幼字第1050059143號臺中市私立新幼華幼兒園,8775e91a-41c6-428e-8a5b-22bb515e20e9
中市教幼字第1010034945號臺中市私立新秀山幼兒園,d50bc11a-f676-4700-beec-70851de25521
中市教幼字第1080035170號臺中市私立迪斯耐幼兒園,f8d2a6d5-ccf7-4f93-8c4c-b5d068c7a829
中市教幼字第1010054866號臺中市私立永真幼兒園,698cff92-ae5b-41c5-9ad7-c2cf8e03f74c
中市教幼字第1060021939號私立弘光科技大學附設臺中市平等幼兒園,7e9f6e92-cfab-4b2f-a473-4facfedbb4eb
中市教幼字第1040081923號臺中市私立尚恩北勢幼兒園,d1355625-6bce-4166-87c5-af7ce3ef20da
中市教幼字第1070085343號臺中市私立加州幼兒園,ab3e7ff0-de72-41a6-a420-c23d5e5b5c80
中市教幼字第1100051763號臺中市私立頂尖合得鑫幼兒園,dbc04613-b313-40bb-b1e2-65a8d48c62cf
中市教幼字第1100072982號臺中市私立迷鹿森林幼兒園,03174094-c687-44f8-9ce5-f5dc6d22bb9a
中市教幼字第1070076590號臺中市龍井區龍峰國民小學附設幼兒園,89f95b5a-c259-470e-a94c-91c82d1ffcef
中市教幼字第1030071448號臺中市龍井區龍泉國民小學附設幼兒園,601ae5aa-c4c8-4bf2-b5a3-78e1effa1ec1
中市教幼字第1040031622號臺中市立龍井幼兒園,7ba2dc66-17dc-4632-ac27-5a561d3e2a64
中市教幼字第1070112448號臺中市立龍井幼兒園龍津分班,06c0ddab-7ed2-417f-bc92-2268bf705658
中市教幼字第10400316222號臺中市立龍井幼兒園山腳分班,586fddce-4216-4e5b-a79b-fbe90132e861
中市教幼字第10100705155號臺中市立龍井幼兒園麗水分班,4ac1bac6-330e-4484-b71b-c3ebb3fa46ba
中市教幼字第1010083345號臺中市立龍井幼兒園龍崗分班,e6245318-82a7-4fe3-bd5f-c8f0a4f6d4c6
中市教幼字第10100705157號臺中市立龍井幼兒園竹坑分班,f5d6d536-673a-4568-a98a-a73e6b200823
中市教幼字第1090076486號臺中市龍井區龍井國民小學附設幼兒園,714aa3fa-8496-4b10-b261-6dec9a2e92a4
中市教幼字第1100062817號臺中市龍井區龍津國民小學附設幼兒園,1599fce7-6b96-48fe-a5d9-64933662afeb
中市教幼字字第1100084270號臺中市私立科喬幼兒園,f75ca1ce-ddad-4a48-8d07-ce12e7d2b8ce
中市教幼字第1080032126號臺中市私立苗圃幼兒園,9ba34083-5523-4938-bf88-31c5be4034fb
中市教幼字第1010023177號臺中市私立立佳幼兒園,de0de14c-5c79-4b03-b242-bc513c9ab2bc
中市教幼字第1050058597號臺中市私立嘉仁幼兒園,29253a76-c281-4f47-80eb-09746f1e9c6e
中市教幼字第1030079404號臺中市私立培育幼兒園,a853b661-ae58-4864-8a4f-6ee988431cff
中市教字第1010080391號臺中市私立小太陽幼兒園,783540c9-a9c3-4abd-8e93-7392f0673943
中市教幼字第1040008208號臺中市私立娃娃國幼兒園,7dad363a-4ec4-4696-ad6d-59c1573d94e5
中市教幼字第1050092791號臺中市私立紅博士幼兒園,a4445781-07ab-46bd-ac42-40efa7eea4d5
中市教幼字字第1100064457號臺中市梧棲區梧棲國民小學附設幼兒園,2c2ee940-e4a9-41ac-88fd-9c3d68703459
中市教幼字第1090018742號臺中市梧棲區中港國民小學附設幼兒園,23ec5365-365b-475d-ab17-1aff6032c2dc
中市教幼字第1060078396號臺中市梧棲區中正國民小學附設幼兒園,6562c958-bc79-4533-9e81-2ffa189d94eb
中市教幼字第1060081836號臺中市梧棲區永寧國民小學附設幼兒園,e51a831e-aee7-4be8-bcb0-a94d5b2e3db1
中市教幼字第1040010443號臺中市立梧棲幼兒園,d39add60-c213-4fbc-b27c-2d380f3d3edb
中市教幼字第1010029074號臺中市私立慈興幼兒園,df068a8e-8a14-406f-a069-1fbdda5ae7a6
中市教幼字第1070025140號臺中市私立梧棲向日葵幼兒園,bfbb40c8-ac70-4dd2-b08f-0a4bb2f0ec4a
中市教幼字第1010025235號臺中市私立善美真娃得福幼兒園,a1006634-05db-4c03-bd3d-176a16bc19be
中市教幼字第1010029841號臺中市私立貴族幼兒園,da65395c-a242-44ea-b6f7-602b564da99b
中市教幼字第1080076309號臺中市私立新象幼兒園,47cec9ce-1a9e-43dc-bfec-e7e18b79cffd
中市教幼字第1010026904號臺中市私立綠太陽幼兒園,31709335-2e26-4ad7-ae01-37ab10deea2e
中市教幼字第1010023328號臺中市私立新中華文藻幼兒園,bb41547f-fa12-4a9b-abfa-08f5b61a15c0
中市教幼字第1080001731號臺中市私立新中華文藻幼兒園易寶貝分班,ecb783f3-df63-4a0e-8930-faa63fe27cc3
中市教幼字第1060065177號臺中市私立親子田藝術幼兒園,5f59d23c-ec6e-47d7-9d21-3aab976fd77c
中市教幼字第1030105937號臺中市私立有志幼兒園,25a3354a-8c04-4cf0-bc5e-e68680d20242
中市教幼字第1050004165號臺中市私立梧棲同德幼兒園,663e405f-c647-41a0-b751-199075635517
中市教幼字第1040067842號財團法人海聲人智學教育基金會附設臺中市私立海聲華德福幼兒園,dfb730bb-8bd3-49f9-857a-b363795cf83c
中市教幼字第1070022990號臺中市私立有一加幼兒園,61851e82-6111-4b57-8465-00fb34ac77e4
中市教幼字第1080107006號臺中市私立夏洛特幼兒園,2bcb80db-ab60-4fb1-af95-e32dea3c273c
中市教幼字第1050066994號臺中市清水區甲南國民小學附設幼兒園,47a355d0-b0bc-4639-bb6d-ddb0340016bc
中市教幼字第1040068136號臺中市清水區三田國民小學附設幼兒園,22f99b95-5c4e-4abc-a6a2-ee8ddb9ceb47
中市教幼字第1090068887號臺中市清水區大楊國民小學附設幼兒園,0b17f4d9-ac2a-4140-96df-4f4d41047e55
1100061747字第1100061747號臺中市清水區建國國民小學附設幼兒園,1d66c78b-a00a-41af-81b0-d124c958146c
中市教幼字字第1070077689號臺中市清水區西寧國民小學附設幼兒園,38ddc0d3-1467-458d-b264-60dab1a14dbb
中市教幼字第1080117397號臺中市清水區清水國民小學附設幼兒園,baa2b249-df5b-467b-9398-c80227c1f888
中市教幼字第1060072957號臺中市清水區東山國民小學附設幼兒園,786edc85-0c6d-4fe0-af19-e96a35cb3d62
中市教幼字第1100057073號臺中市清水區大秀國民小學附設幼兒園,2db04581-3ae0-4a8f-b505-a126125ffd2f
中市教幼字第1100069573號臺中市立清水幼兒園,4716739c-06bf-42f6-8358-0b5ef04defca
中市教幼字第11000695732號臺中市立清水幼兒園高西分班,359acbf3-f38b-474b-8264-d30e5a9d5218
中市教幼字第11000695731號臺中市立清水幼兒園鰲峰分班,01c05407-e94c-4d82-a988-7ee41e1c11f4
1100061756字第1100061756號臺中市清水區吳厝國民小學附設幼兒園,013b4ece-ebf3-4dcc-a211-76bfbf9bd105
中市教幼字第1080071746號臺中市清水區槺榔國民小學附設幼兒園,0cbe605c-7911-40c9-bd0a-afa4062d6113
1100058231字第1100058231號臺中市清水區高美國民小學附設幼兒園,d8ccc890-284d-4bcd-a627-b584cdf026be
中市教幼字第1010015113號臺中市私立樹人幼兒園,fb1326ec-3b82-47d7-8933-d36c964644fe
中市教幼字第1010019462號臺中市私立馬丁幼兒園,c41ade56-6ad0-4624-80a0-23168dd165de
中市教幼字第1010026230號臺中市私立容幼幼兒園,f419a2b8-a7d4-4e8b-ad90-823f146c9bd8
中市教幼字第1010026705號臺中市私立晶晶幼兒園,bc001c7d-0ed2-4a15-93ad-ebb1e9d5ca9c
中市教幼字第1040052878號臺中市私立芳美芳幼兒園,5030051e-c44d-4a79-b459-69cacf295754
中市教幼字第1090049225號臺中市私立芝蔴街幼兒園,b9155e25-8c97-4d82-8ae3-3a284c400608
中市教幼字第1050095818號臺中市私立芝蔴街幼兒園西社分班,9cf442c9-e628-4903-b591-397504137b63
中市教幼字第1040031371號臺中市私立美德幼兒園,a08b18ec-0030-45e0-b533-c7b8738eba7e
中市教幼字第1070065407號臺中市私立田園幼兒園,121e1e5b-5ca6-4f6c-896f-b38aac9fec0b
中市教幼字第1100064141號臺中市私立清水怡安幼兒園,e32dac5b-ef68-475e-b47e-3d22c6ad55ab
中市教幼字第1060071721號臺中市大甲區德化國民小學附設幼兒園,79525082-4fc6-403a-9369-936d93345af3
中市教幼字第1100076213號臺中市大甲區華龍國民小學附設幼兒園,c4b8e6d8-38df-4558-9560-e709f72b2038
中市教幼字第1070067029號臺中市大甲區文昌國民小學附設幼兒園,8aae31bd-179a-40d3-a6fd-21d726c37ef8
中市教幼字第1060076299號臺中市大甲區大甲國民小學附設幼兒園,3420f156-1c76-49e4-978f-13da2ccbe730
中市教幼字第1050061185號臺中市大甲區順天國民小學附設幼兒園,fe75cf47-763c-4851-a389-59b4f3990b74
中市教幼字第1030033274號臺中市立大甲幼兒園,ebbf6a32-0afa-471c-8cbc-368c7080ec72
中市教幼字第10300658535號臺中市大甲區西岐國民小學附設幼兒園,307319bc-dd7b-481f-a611-5886cb8cc529
中市教幼字第1080076116號臺中市大甲區文武國民小學附設幼兒園,95736fcb-3d85-40d6-9088-9a310d3e0c73
中市教幼字第1040085463號臺中市私立熊寶寶幼兒園,6d33a37d-3d64-4ecd-a1e2-762b2d5823b9
中市教幼字第1010019111號臺中市私立馬克幼兒園,1a32f58e-33ed-4d9e-bad8-cf2f43626ea3
中市教幼字第1010018943號臺中市私立安心幼兒園,f140a8d0-6958-402b-8d34-7c728e8fe9ad
中市教幼字第1060107075號臺中市私立人德幼兒園,813832c3-6837-414a-b1cd-2d9b0058073f
中市教幼字第1010030738號臺中市私立柏克萊幼兒園,59d2d4a8-2c81-4a27-8b80-b1ab7f2dc7de
中是教幼字第1050062634號臺中市私立愛力美幼兒園,ac57e270-de58-4cdf-8b76-ee9bffc383ff
中市教幼字第1060071334號臺中市私立溫哥華幼兒園,a5f44335-5be7-4a8a-a8d9-7836e53fc515
中市教幼字第1050071017號臺中市私立大自然幼兒園,38310e3d-ed83-47cd-bd5c-f6675a97ff41
中市教幼字第1060070971號臺中市私立大甲愛兒堡幼兒園,4dbc7420-75c9-4968-b21b-6723d4103fca
中市教幼字第1080007750號臺中市私立小哈佛幼兒園,369bdeec-d6d6-4904-80f3-230bbaa65b0e
中市教幼字第1050105926號臺中市私立大甲何嘉仁幼兒園,1da0e53c-e1e5-41c1-a314-b61db7721361
中市教幼字第1020013141號臺中市私立優生幼兒園,63f96d55-225e-4237-a43d-f8dfb986d8c3
中市教幼字第1070017917號臺中市私立文采幼兒園,d923a5a9-7387-43a4-95da-2e0c85e9a575
中市教幼字第1010035703號臺中市私立明典幼兒園,e7b9e5fd-1971-4c7f-9920-6df9b09f378f
中市教幼字第1100057584號臺中市外埔區水美國民小學附設幼兒園,c2275643-1ede-4350-a3c4-065c07a78213
中市教幼字第1100065256號臺中市立外埔幼兒園,4102a79f-49c6-4a05-a216-23173bf4065d
中市教幼字第1080072658號臺中市外埔區外埔國民小學附設幼兒園,5a60a386-4dc7-44af-9876-3213167fb516
中市教幼字第1050061099號臺中市外埔區馬鳴國民小學附設幼兒園,192a16d5-5ae7-4d49-aa42-03a79c2b60ac
中市教幼字第1050062487號臺中市外埔區安定國民小學附設幼兒園,e3f1cd85-0fce-4a40-bb31-dcea1a4de4d6
中市教幼字第1060073018號臺中市外埔區鐵山國民小學附設幼兒園,5daa50b7-fb4d-42e0-ba0d-2601e9982b9c
中市教幼字第1010036701號臺中市私立欣達幼兒園,a5b4eef3-739b-4395-a83c-3f9b266fad36
中市教幼字第1060078505號臺中市大安區永安國民小學附設幼兒園,42469f17-b4da-4690-b2ab-e5bb62597d0a
中市教幼字字第1040068870號臺中市立大安幼兒園,5c49c52c-a75e-4bc5-8974-1283b0314a24
中市教幼字第1080072117號臺中市大安區大安國民小學附設幼兒園,efdc3090-9c7f-44bd-9ea7-5e62a556cf2f
中市教幼字第1070070306號臺中市大安區海墘國民小學附設幼兒園,85e43bcd-de58-4fee-9c10-0592e04ca803
中市教幼字第1010022939號臺中市私立我家幼兒園,2870e626-e095-4fd7-9e9a-97bea28332b1
中市教幼字第1010035512號臺中市私立美強生幼兒園,0798da27-a588-4dab-8c31-30f3ea54f5ce
北市幼兒園證字第175-4號臺北市中正區螢橋國民小學附設幼兒園,2b65ce9d-0bae-4eee-9243-9a155745aba2
北市幼兒園證字第173-1號臺北市中正區國語實驗國民小學附設幼兒園,09266d6c-e1b4-4868-a001-e8f8fd47569b
北市幼兒園證字第405-2號臺北市中正區東門國民小學附設幼兒園,7778f052-80f2-4abb-92fb-abcb9856c5a1
北市幼兒園證字第404-2號臺北市中正區忠義國民小學附設幼兒園,7c6e769d-5aa2-45ac-b2cc-786670bf6161
北市幼兒園證字第406-3號臺北市中正區河堤國民小學附設幼兒園,f7235ebf-cd50-476b-93fa-d8a50995bcaa
北市幼兒園證字第354-2號臺北市中正區忠孝國民小學附設幼兒園,6634c01b-27c2-41b2-b8b7-70a3ece4c10a
北市幼兒園證字第220-2號臺北市立大學附設實驗國民小學附設幼兒園,3b1d87bb-d815-446f-94f5-9560af054f7d
北市幼兒園證字第324-3號臺北市立中正幼兒園,d5474d34-ef2d-4e13-b42d-4f490956d67a
北市幼兒園證字第740-1號臺北市中正區南門國民小學附設幼兒園,f04b3bf9-3bdb-4af0-82d7-db68105541f7
北市幼兒園證字第157號臺北市私立南門幼兒園,98a81089-6020-434c-9846-f757ce7ec340
北市幼兒園證字第174-2號財團法人中華基督教衛理公會附設臺北市私立城中衛理幼兒園,d6118cbb-03d5-467c-b752-eb075e63096f
北市幼兒園證字第242-2號財團法人台北市私立強恕高級中學附設臺北市私立幼兒園,85677094-b1ef-4be9-9f64-1e5053f62a48
北字第116-1號國防醫學院附設臺北市私立愛德幼兒園,99fe8977-d725-405f-9a98-9b07667b9d4e
北市幼兒園證字第344號臺北市私立傑瑞富幼兒園,ff685bb6-5536-4aff-837d-543f4d1fba7c
北市幼兒園證字第114-1號臺北市私立聯華幼兒園,9f98be1c-c7da-4a77-92d9-a2c48354498e
北市幼兒園證字字第113-1號臺北市私立中正區清華幼兒園,229505c0-afb4-4ab4-9f1e-ff165c8c1d22
北市幼兒園證字第478號臺北市私立寶貝幼兒園,b95d475e-fd2c-4787-9d4b-dd20f5297f25
北市幼兒園證字第480-2號法務部附設臺北市私立員工子女幼兒園,dc186341-7d64-4555-9bc1-0a2aeb822297
北市幼兒園字第532-5號國立臺灣大學醫學院附設醫院附設臺北市私立員工子女幼兒園,d3ec057d-80ea-42fb-905f-062bec82e9e5
北市幼兒園證字第552-1號臺北市私立蒙特梭利童圓幼兒園,1532562b-0bd7-450a-b24a-01c591d63071
北市幼兒園證字第531-1號臺北市私立巨勝幼兒園,284c11df-63e9-433b-b934-af5fee494a43
北市幼兒園證字第631號臺灣高等法院附設臺北市私立員工子女幼兒園,d12aaa9e-ff91-483c-a681-725cba77f82c
北市幼兒園證字第626號財團法人信誼基金會附設臺北市私立實驗幼兒園,ac156c89-d9a8-434a-b893-f8b9028b0e49
北市幼兒園證字第548號臺北市私立涵鈺新天地幼兒園,be24b36b-25bb-44c4-a3a8-adaf21f4003b
北市幼兒園證字第654號臺北市私立智寶園幼兒園,75fd533e-e4cb-4162-aeb4-b0e1aedb5bac
北市幼兒園證字第649-1號臺北市私立百家姓幼兒園,15b934fe-45e9-420c-b292-937e7ab20ef9
北市幼兒園證字第706號臺北市私立維格幼兒園,56ad5c09-424f-447d-8881-1b668ece906b
北市幼兒園證字第730-1號臺北市私立乖乖幼兒園,fcf8451f-1dcb-47f6-aa83-a1caabbb3dbe
北市幼兒園證字第733號臺北市私立家緣蒙特梭利幼兒園,4fb6e1ff-7622-41b9-9577-2319b47ee530
北市幼兒園證字第739-1號臺北市私立何嘉仁臨沂幼兒園,7f28d6f1-908f-49e3-8ede-98f36cfb0dc4
北市職場教保證字第3號教育部忠孝大樓職場互助教保服務中心(委託社團法人台北市教保人員協會辦理),f6ff35f2-ed37-4e3d-a089-af954c671274
北市幼兒園證字第755-1號臺北市螢橋非營利幼兒園(委託耕莘健康管理專科學校辦理),5bbfafe4-42a4-4ccf-b6a0-1f5ae3387165
北市幼兒園證字第397-2號臺北市大同區雙蓮國民小學附設幼兒園,c903d838-c364-4656-8ef2-ecc49da01aea
北市幼兒園證字第333-2號臺北市大同區延平國民小學附設幼兒園,7331edcb-a4d5-47ed-823d-85e95eab3d53
北市幼兒園證字第287-4號臺北市大同區太平國民小學附設幼兒園,03f4aef7-3527-494f-a1f1-0efd3007e87e
北市幼兒園證字第271─2號臺北市大同區大同國民小學附設幼兒園,bfad2db6-c7e4-4d12-868b-145743a3438c
北市幼兒園證字第272-2號臺北市大同區日新國民小學附設幼兒園,a20991a5-251a-4ef8-b6b7-51253dd95530
北市幼兒園證字第263-4號臺北市大同區大橋國民小學附設幼兒園,b5d7095c-1214-4701-a732-2899fe925c91
北市幼兒園證字第262-4號臺北市大同區大龍國民小學附設幼兒園,a85895f3-bd99-45f8-82a1-d47ebf9dc202
340字第1號臺北市立大同幼兒園,dccdb3c4-6d74-4de9-8b3f-5d4a557e8a6b
北市幼兒園證字第334-2號臺北市大同區永樂國民小學附設幼兒園,3d6e05b6-e6c9-4963-84db-9fd7118c27ec
北市幼兒園證字第339-2號臺北市大同區蓬萊國民小學附設幼兒園,dc516bcc-18ca-4a75-8044-43b0655dd045
北市府教人字第10143913500號臺北市立啟聰學校幼兒部,381a0fce-6117-4f34-a214-e15b6f9d94d5
北市幼兒園證字第14-1號臺北市私立功文雪泥幼兒園,96b5d912-ed86-42b6-8eae-f6a1a1a37eed
北市幼兒園證字第21-1號臺北市私立博登幼兒園,04ac700d-98fa-4e2f-ac31-7a49f1a0deeb
北市幼兒園證字第17-1號臺北市私立功文成長幼兒園,476c9b8f-9a45-4908-9183-fb2cec180564
北市幼兒園證字第122號臺北市私立育學幼兒園,783c4ca0-3d93-4943-9bdb-15670eb135c2
北市幼兒園證字第138號臺北市私立親兒園蒙特梭利幼兒園,73afe16f-f8cb-4794-93d1-8861e79efa10
北市幼兒園證字第578-1號臺北市私立格爾登幼兒園,a0fdd6f4-1c9b-4602-b510-3e6f55b35969
北市幼兒園證字第614號臺北市私立水晶幼兒園,e53a9885-1083-4646-9567-667620b911e4
北市幼兒園證字第613號臺北市私立海桔斯幼兒園,cc246ccc-8511-40ce-ac9f-a57e0df8a38a
北市幼兒園證字第20-2號財團法人陳德星堂附設臺北市私立德星幼兒園,e744d834-80b8-4533-92f9-66578a67c31c
北市幼兒園證字第661號臺北市私立甜甜屋幼兒園,6e0fee00-9416-4668-a0ea-e4fdb8d42c27
北市幼兒園證字第16-1號財團法人天主教會台北教區附設臺北市私立聖心幼兒園,0248f52e-9037-4945-8582-c8aa7dd01496
北市幼兒園證字第18-2號財團法人王氏太原堂附設臺北市私立太原幼兒園,96d252bf-47fe-4bbd-824f-db19095ef1a9
北市幼兒園證字第800號臺北市私立海格斯幼兒園,465f659e-1815-475c-a2ee-f1f459c9d1d1
北市幼兒園證字第645-5號臺北市蘭州非營利幼兒園（委託財團法人彭婉如文教基金會辦理）,2dcbd449-1bc3-4098-b687-384a0bc19186
北市幼兒園證字第788號臺北市大龍峒非營利幼兒園（委託財團法人台北基督教女青年會辦理）,f00ddd28-e7fa-4373-bfde-3c461cd01557
北市幼兒園證字第792號臺北市明倫非營利幼兒園（委託社團法人中華兆陽文教發展協會辦理）,4268c6d4-29ee-4a09-b4f3-b22b60bb297f
北市幼兒園證字第190-1號臺北市立中山幼兒園,be707e0f-f0fa-4e83-a676-c873cffb420c
北市幼兒園證字第343-3號臺北市中山區長安國民小學附設幼兒園,b4b9cf1c-5648-4915-8e08-c3307418268d
北市幼兒園證字第341-1號臺北市中山區懷生國民小學附設幼兒園,db44951b-da4b-4328-b8c4-1b027ad51982
北市幼兒園證字第316-2號臺北市中山區大佳國民小學附設幼兒園,7c49a409-ed5a-42a1-bb58-e84c41011b67
北市幼兒園證字第302-7號臺北市中山區濱江國民小學附設幼兒園,a8f02f99-9197-4d38-8720-78d4214dbd3c
北市幼兒園證字第320-3號臺北市中山區大直國民小學附設幼兒園,efae6030-7e9c-45bc-9b26-4df7c191f986
北市幼兒園證字第303-3號臺北市中山區永安國民小學附設幼兒園,8e9bb1ba-0898-4cd7-8d05-5064deae1227
北市幼兒園證字第241-6號臺北市中山區五常國民小學附設幼兒園,e1e4c3da-f2d1-43d2-982b-bfafb89a3f6d
北市幼兒園證字第202-3號臺北市中山區吉林國民小學附設幼兒園,dc1176b5-e4c5-4496-902b-ba2222c7ebed
北市幼兒園證字第240-3號臺北市中山區長春國民小學附設幼兒園,e3cde705-c6ee-4439-8c61-4d97c83cbc0d
北市幼兒園證字第203-2號臺北市中山區中山國民小學附設幼兒園,ad4c2a7b-48bd-4173-bfbe-7670a73ee0bc
