高市教幼字第10937383400號高雄市楠梓區後勁國民小學附設幼兒園,8b7a74bd-97bc-48cc-ba20-4555961e59ff
高市教幼字第10735822700號高雄市楠梓區加昌國民小學附設幼兒園,1807a011-b2ab-4f44-b751-6491151b6e4c
高市教幼字第10835735200號高雄市楠梓區右昌國民小學附設幼兒園,9ddd8e88-805e-4a2f-a592-56a46e6fdf64
高市教幼字第10937666600號高雄市楠梓區莒光國民小學附設幼兒園,160bb72f-ed6d-460a-a25d-dbbce00f9c1b
高市教幼字第10937334300號高雄市楠梓區油廠國民小學附設幼兒園,d934a8df-47cf-4824-9649-8f79826f7ade
高市教幼字第10935125600號高雄市私立育志幼兒園,8389cfd5-b255-427f-9c8e-112ca01c5bbc
高市教幼字第10133511000號高雄市私立吉米亨利幼兒園,cd72ae82-4740-4a01-ae37-d99373402abb
高市教幼字第10132906100號高雄市私立愛吉兒幼兒園,c158e8a1-e4d5-4743-8196-03b84afce51f
高市教幼字第10133107100號高雄市私立乖寶貝幼兒園,d2112cea-269f-4df1-ab7b-d1cd4d6f06ce
高市教幼字第10134870900號高雄市私立野鳥幼兒園,62ab5113-eb46-44c7-9985-81dd9a97bbb3
高市教幼字第10133372600號高雄市私立小豆豆幼兒園,0fd81354-795c-4838-b13b-5bc1e95021c7
高市教幼字第10836004800號高雄市私立英倫幼兒園,09b95cc5-4ed9-4abd-9c7d-674f1def2fbf
高市教幼字第10937227400號高雄市私立百立幼兒園,88feeb30-cdef-4525-9915-1ac486c13323
高市教幼字第10835650000號高雄市私立達仁幼兒園,1ae7cb63-2bab-4aff-95bd-e1d300db1513
高市教幼字第10137588000號高雄市私立成就非凡楠梓幼兒園,62c49e61-9207-40ab-9cbd-890c81c465b2
高市教幼字第10137263400號高雄市私立牛頓幼兒園,2cfe7fb0-9c7c-48ab-9c9d-dfde43eb89b0
高市教幼字第10137444800號高雄市私立楠梓長春藤幼兒園,b15b3c77-d37a-45eb-9c0c-b4f1db405da6
高市教幼字第10534587700號高雄市私立福慧幼兒園,cb816a76-cde4-4139-89ce-dddc0be6757d
高市教幼字第10138548400號高雄市私立學儒幼兒園,bcc25ea5-47b5-45f1-8ad9-f6d6631d5ae8
高市教幼字第10434017300號高雄市私立小種籽幼兒園,e9c09d99-a3a5-46bb-ab30-30ea5bb4cea2
高市教幼字第10137987600號高雄市私立經濟部加工出口區楠梓示範幼兒園,261d6dd6-45a3-400b-9f4f-f740d43a16e5
高市教幼字第10138121100號高雄市私立育正幼兒園,3d25556f-190a-4a88-9867-3357f439973c
高市教幼字第10138468300號高雄市私立嘉欣幼兒園,2828dc29-f8cd-45e0-a6a8-ab186135bad1
高市教幼字第10138474400號高雄市私立楠梓童心園幼兒園,9e7e59e6-f97a-458e-a5dc-29e4890feeb6
高市教幼字第10830644200號高雄市私立右昌麥米倫幼兒園,1d582c21-47b5-4960-a753-7e7e0edbfb95
高市教幼字第10138482300號右昌基督長老教會附設高雄市私立右光幼兒園,21184205-55af-4baa-acb4-399733cd5acb
高市教幼字第10734056300號高雄市私立貝吉田幼兒園,cb832d0a-1076-4a09-8541-4338717a2c53
高市教幼字第10836912900號財團法人台灣中油股份有限公司職工福利委員會附設高雄市私立煉油廠幼兒園,d477a60d-426f-440a-85f1-8c1be5670680
高市教幼字第10339031500號高雄市私立威廉王子幼兒園,f3eebc6d-2d60-4f7b-8412-47d8416950ff
高市教幼字第10537726600號高雄市私立愛萌兒幼兒園,e90543d6-ddd1-41cf-8836-6bd03ec200aa
高市教幼字第11030075200號高雄市私立何嘉仁楠梓幼兒園,b02117dc-e626-43e1-b78a-2281994f71f9
高市教幼字第11034649800號日月光集團聯合職工福利委員會附設高雄市私立三好幼兒園,df0d55e6-3ffb-4ff1-bae2-ef3c2f7accab
高市教幼字第11035785000號高雄市私立伊頓大地幼兒園,6a890236-0d82-4e37-9e69-f110a225aa45
高市教幼字第11036327900號高雄市私立星彩幼兒園,aba0ae9d-2ea4-4c8b-ba78-3ada163cfc2c
高市教幼字第10937708400號高雄市翠屏非營利幼兒園(委託財團法人樹德科技大學設立之樹德科技大學辦理),eb1a1026-951a-462b-8bd1-2f3f5817f2df
高市教幼字第10735694400號高雄市右昌非營利幼兒園（委託社團法人高雄市婦幼培訓關懷協會辦理）,0bda0e3e-73fd-4e8b-bdbf-a911d131c247
高市教幼字第10935912100號高雄市後勁非營利幼兒園(委託社團法人高雄市碩苗社會教育關懷協會辦理),cbb02181-b510-44c1-99ca-e14b7e5ad118
高市教幼字第10735545900號高雄市小港區太平國民小學附設幼兒園,a446acc7-aa14-457c-9488-36f0bbb11930
高市教幼字第10937668000號高雄市小港區桂林國民小學附設幼兒園,adecf3b5-967a-48b7-885c-fcbb0bdf9f4a
高市教幼字第107535509000號高雄市小港區坪頂國民小學附設幼兒園,cbed44d2-a221-44e3-8032-0d0a9191af11
高市教幼字第10337219100號高雄市小港區漢民國民小學附設幼兒園,0e4fe9cf-b550-4550-8038-934d18e8a964
高市教幼字第11036466500號高雄市小港區二苓國民小學附設幼兒園,40f7ae8b-a7d6-43f3-a49c-4f98ace36a59
高市教幼字第11131592400號高雄市小港區小港國民小學附設幼兒園,4a6a7f9c-93aa-474a-894d-575f17a9d610
高市教幼字第10835700500號高雄市小港區華山國民小學附設幼兒園,7d76c305-21f9-449e-a0da-1ad23ec62895
高市教幼字第10937674000號高雄市小港區青山國民小學附設幼兒園,8be063a1-447f-4b1a-916a-24fcec7c49de
高市教幼字第10735810500號高雄市小港區鳳林國民小學附設幼兒園,274cd046-3be3-4eb4-a4e7-0d8e7bb62c80
高市教幼字第11036466400號高雄市小港區港和國民小學附設幼兒園,7840c70a-5716-4ee1-8cdf-11addb3a5831
高市教幼字第10134966900號高雄市私立明星幼兒園,4b0aee1e-896a-419f-9f01-544a4b12d75b
高市教幼字第10133860300號高雄市私立龍之堡幼兒園,7b0eb54f-3bc3-4350-92c9-2976a05327cb
高市教幼字第10133869800號高雄市私立創新幼兒園,570158de-ef32-426f-bc39-8e66649f2656
高市教幼字第10132192600號高雄市私立子信幼兒園,8c872847-b222-40c2-a3b0-5c48d45a1741
高市教幼字第10334195800號高雄市私立慈文幼兒園,75b64cf0-8f88-4f09-88df-4dcaa746f555
高市教幼字第10133866200號高雄市私立雨果幼兒園,384d2bff-9a90-498e-80fa-75c292c33224
高市教幼字第10631933200號高雄市私立佳倍佳幼兒園,dde087ce-04e5-4dca-88ec-7c54664c6e11
高市教幼字第10133867700號高雄市私立山明幼兒園,748633e1-a58f-4441-ae6d-1581db02cc58
高市教幼字第10631541300號高雄市私立萊茵城堡幼兒園,3c6f6a0e-0437-470d-bc0d-e8838c173762
高市教幼字第10134511400號高雄市私立真愛龍之堡幼兒園,e57a6e5f-e14f-4829-a035-4973e5c1a08c
高市教幼字第10135089600號高雄市私立宏平幼兒園,b541a77e-b973-4851-80a0-29f747c6794c
高市教幼字第10137322900號高雄市私立小港艾心幼兒園,737bbc58-fdae-420a-9407-b34b7a67de03
高市教幼字第11038201100號高雄市私立文親幼兒園,68bd3ddc-f6d4-4342-9e70-2b19024b680b
高市教幼字第11037460900號中國鋼鐵股份有限公司職工福利委員會附設高雄市私立中鋼幼兒園,57e49835-3446-41db-b353-a13ec22ef7c2
高市教幼字第10137204200號高雄市私立光庭幼兒園,bb2d2253-1d1c-48be-b050-5b4c85caf33f
高市教幼字第10137489200號高雄市私立鳳源幼兒園,c9b97dba-055e-41c5-a0bc-0ba069bea9da
高市教幼字第10137914900號高雄市私立小港佳欣幼兒園,3621b96c-79da-4f3a-b1c3-269ed7d77191
高市教幼字第10638138600號高雄市私立華升幼兒園,20ace3ae-e99d-433d-b588-fbc54e5892cd
高市教幼字第10137919100號高雄市私立優群星星幼兒園,032513bd-4f94-4f7f-b287-caa88343d842
高市教幼字第10137681100號高雄市私立大鵬幼兒園,6845443e-b7f2-4472-a858-d42140d0986e
高市教幼字第10138166600號高雄市私立佳欣幼兒園,9f839860-d68c-4083-a5cd-b1f240fabefa
高市教幼字第10138644500號高雄市私立小博士幼兒園,71e7c0fb-55bf-4be0-ab25-c42b6938133a
高市教幼字第10138515600號高雄市私立正一幼兒園,70a9a8a7-4be3-4ac3-98d0-2cec69c481e3
高市教幼字第10139332400號高雄市私立宏光幼兒園,b212b1db-9917-4bf3-bd85-14b9ffb48233
高市教幼字第10139370300號高雄市私立下庄幼兒園,179c4371-e21f-4004-9028-e5aeefc8ce7b
高市教幼字第10138853400號高雄市私立高松幼兒園,e212fe8d-b5e0-4f14-8d29-c2018fa080dc
高市教幼字第10330922600號高雄市私立經嚞幼兒園,f69d263f-0ac7-46e4-843a-db77c1a1fd63
高市教幼字第10236671600號高雄市私立教育之心幼兒園,87a2cfb5-6844-4ec5-b61f-2cfaa68d9384
高市教幼字第10935634900號高雄市私立雨青幼兒園,5033e271-6d0e-4378-9066-bc25873d1010
高市教幼字第10935803500號高雄市私立寶貝明星幼兒園,0fc006ac-f519-474a-93c9-da1dea46daca
高市教幼字第10734931600號高雄市小港非營利幼兒園(委託社團法人高雄市社區教育協會辦理),062a0f6a-16d7-4a87-8cdf-fba1c11b4aaf
高市教幼字第10935846300號高雄市港和非營利幼兒園（委託財團法人高雄市私立復華高級中學辦理）,11417990-bb68-4f67-a522-6880fedf066f
高市教幼字第11034594800號高雄市鳳陽非營利幼兒園（委託社團法人高雄市關懷家庭教育發展協會辦理）,76521163-2973-46d1-9110-2a69eec7d0ba
高市教幼字第10937331100號高雄市左營區文府國民小學附設幼兒園,cdc1352c-ad23-4493-a702-47f65bb03bbd
高市教幼字第11031126600號高雄市左營區舊城國民小學附設幼兒園,df9dabba-e5a7-4717-9270-20f444e5b5ae
高市教幼字第10735412100號高雄市左營區永清國民小學附設幼兒園,89fe68d7-63a9-4868-89d8-c3a243ce3df7
高市教幼字第11035667800號高雄市左營區明德國民小學附設幼兒園,4e5ec481-150e-45a3-bb95-12da87810a4e
高市教幼字第10735588900號高雄市左營區新上國民小學附設幼兒園,f18faadb-8ecf-44e0-9680-0b45300c40d7
高市教幼字第10535254600號高雄市左營區左營國民小學附設幼兒園,4f5c57ec-7328-48a4-947b-ee6e5cf7e9cf
高市教幼字第10337219100號高雄市左營區勝利國民小學附設幼兒園,ea7884d6-6421-4a11-8b0c-9b0a7651242c
高市教幼字第10937695600號高雄市左營區屏山國民小學附設幼兒園,b47f6686-ae5f-48fb-83dc-6a8206bb5b82
高市教幼字第10436349700號高雄市左營區新莊國民小學附設幼兒園,6d07a79e-6d65-485a-84ad-725e94d57155
高市教幼字第10337506400號高雄市立裕誠幼兒園,8a88d549-b70c-41d9-9bf1-406ff83ceb4e
高市教幼字第10330815200號高雄市私立丹苨薾幼兒園,447a7f43-6275-4908-862a-34f9ee4be14a
高市教幼字第10230501900號高雄市私立木棉庄幼兒園,a4644112-eb91-4959-9e25-4e0ec1032da4
高市教幼字第10132569000號高雄市私立日大幼兒園,9b1ef79b-775d-4ed9-811e-db1bec9acae1
高市教幼字第10133561900號高雄市私立奧斯佛爾幼兒園,69fbc000-f635-44e6-af05-e72328cdacd7
高市教幼字第10133285800號高雄市私立明倫幼兒園,ba1d4e9a-cea9-4057-95bc-1992a659bc02
高市教幼字第10133098900號高雄市私立芝蔴街幼兒園,e52ba1d3-5d81-4dae-8f5d-3dc4b50ed192
高市教幼字第10730170700號高雄市私立蠶寶寶幼兒園,139b1b43-7196-46b0-b054-64f17552f402
高市教幼字第10333068700號高雄市私立崇德幼兒園,101f153b-f03a-4a9f-a0cf-f8fea8663c3b
高市教幼字第11035411700號高雄市私立哈利幼兒園,4ad0f785-9f13-4ab4-b5c0-8813d05df423
高市教幼字第10930819800號高雄市私立高雄榮民總醫院榮華幼兒園,1ebdb012-7619-4705-b5bd-ebfb32701469
高市教幼字第10135245200號高雄市私立聖心幼兒園,0ebbf253-2196-4248-af0f-46f2ae139f0a
高市教幼字第10136589200號高雄市私立福山可萊蒙幼兒園,e986149b-b05f-49c3-9c89-bcc11d199940
高市教幼字第10138011900號高雄市私立曼哈頓幼兒園,26e50f4b-9428-4dfd-a072-01477c93d770
高市教幼字第10333358500號高雄市私立盧森堡幼兒園,adf697da-74b3-4196-8461-5cc9da07c34c
高市教幼字第10835872100號高雄市私立米倫幼兒園,c3697352-9274-4caa-abbb-7b8b739a3c80
高市教幼字第10830815400號高雄市私立五餅二魚幼兒園,936cdb17-2426-4081-9cda-46c5abfe3e93
高市教幼字第10137436900號高雄市私立明懿幼兒園,2e4b1094-00ca-4de4-8979-619642868ea4
高市教幼字第10834700900號高雄市私立華頓幼兒園,d3e3d246-eb97-4b10-8140-f98193802e61
高市教幼字第10138906600號高雄市私立明華幼兒園,b3d7d727-0b0e-4704-b4dc-647152966069
高市教幼字第11037265900號高雄市私立真愛國際幼兒園,c318252e-96a9-42a0-b3b4-f5b150b6d332
高市教幼字第10138334000號高雄市私立河堤幼兒園,6b9db551-91cc-4521-93d4-9c6afee4464e
高市教幼字第10137583000號高雄市私立喬依斯幼兒園,7565ab39-a107-43e5-a8b7-f1be10b2ca97
高市教幼字第10138472300號高雄市私立喜悅幼兒園,9b8f8a26-ce5c-40e3-b485-f826ffea51d5
高市教幼字第10138715400號高雄市私立小天使幼兒園,0bbbd897-82b0-46bc-a19b-a8574f45e715
高市教幼字第10138332300號高雄市私立愛仁幼兒園,0aba7840-5f1d-4190-bc0b-d1aec41a2044
高市教幼字第11037820600號高雄市私立加州幼兒園,04bb47ac-380b-4f4f-91be-90d93041b3c4
高市教幼字第10735122500號高雄市私立九個果子幼兒園,c145339a-6501-4412-903c-2dc6e70e085c
高市教幼字第10836088400號高雄市私立曾子幼兒園,5899f8a6-b52e-471a-b60c-13678456893e
高市教幼字第10137306500號高雄市私立華爾頓幼兒園,68aea331-f0cd-4b50-8659-fc0309085de7
高市教幼字第10138480400號舊城基督長老教會附設高雄市私立左營幼兒園,6924f34b-b2fa-4846-94e7-73cede706b44
高市教幼字第10138640300號高雄市私立貝安幼兒園,58491270-6c53-469c-81b7-e830a968465a
高市教幼字第10138789400號高雄市私立新莊幼兒園,8993cbdb-7652-42ae-b7e3-73f106392fa6
高市教幼字第11132243800號高雄市私立宗聖幼兒園,0cbe0b34-7b42-411d-85fb-07861b504dc1
高市教幼字第10634486800號高雄市私立麥克安妮幼兒園,fd1d9a60-4857-4659-9885-7a5c153615ac
高市教幼字第10637251900號高雄市私立羅曼頓幼兒園,d95727f5-1667-4be6-88c0-f9db1326d3e0
高市教幼字第10738272400號高雄市私立愛上學幼兒園,146f5167-96ce-4a51-abc5-0999955338d5
高市教幼字第10936080100號高雄市私立傑尼頓幼兒園,2142ff0c-78dc-4ea8-815a-3238ffdbb8d4
高市教幼字第10936478900號高雄市私立柏恩格幼兒園,d1bf6bf3-9ac9-4fde-9464-d68fb5803aeb
高市教幼字第10937293200號高雄市私立威爾森政德幼兒園,aac7e27f-4415-4218-9226-b98ab2d07a99
高市教幼字第11037821600號高雄市私立名恩幼兒園,cc88ebea-9b3b-4bd3-8f4e-d787f9f5c445
高市教幼字第11035040400號高雄市新民非營利幼兒園(委託社團法人台灣公共托育協會辦理),7694bcbe-ff4a-4c21-a8a7-b4a82db3a28d
高市教幼字第10934973000號高雄市龍華非營利幼兒園(委託財團法人正修教育基金會辦理),c1c80cfd-79db-4352-9aaf-80ab3a121e46
高市教幼字第10834926400號高雄市新莊非營利幼兒園（委託財團法人福智文教基金會辦理）,ead63108-69eb-448e-a79f-5eb848acec05
高市教幼字第10935630000號高雄市立德非營利幼兒園(委託社團法人高雄市社區美學教育發展協會辦理),1a137195-8223-445e-8d9d-2eb5f5485168
高市教幼字第11035186100號高雄市文府非營利幼兒園(委託社團法人東台灣幼兒教保專業促進協會辦理),1c54416e-b28e-4499-9f58-2286b5a22ae5
高市教幼字第11036338200號高雄市大義非營利幼兒園(委託社團法人高雄市社區美學教育發展協會辦理),9a3b6e32-4660-4a0e-a1d4-393adaee0801
高市教幼字第11036839300號高雄市左新非營利幼兒園(委託財團法人福智文教基金會辦理),a3eec8ea-3c3b-4217-8c70-49c08a5d91d5
高市教幼字第11036465200號高雄市仁武區八卦國民小學附設幼兒園,dced47fb-ce11-4494-83a4-86f562f5ea2b
高市教幼字第10937664300號高雄市仁武區仁武國民小學附設幼兒園,a2fe44aa-a75d-4cfe-a89b-15ae8ac220d9
高市教幼字第11035731800號高雄市仁武區竹後國民小學附設幼兒園,f3d9dbcf-ae44-42a3-a610-9e27110cce3e
高市教幼字第10936572300號高雄市仁武區烏林國民小學附設幼兒園,5d9bad73-56ff-4989-9f23-82bf9cf47667
高市教幼字第10936508400號高雄市仁武區登發國民小學附設幼兒園,a700240a-c640-40c5-b50a-a104317b574d
高市教幼字第11036677800號高雄市仁武區灣內國民小學附設幼兒園,73b01f9e-47fd-4e3e-ab12-fa754d2ac428
九十府教特字第151115號高雄市立仁武特殊教育學校幼兒部,c7804752-0836-4fba-bdf8-14453556d040
高市教幼字第11132876400號高雄市私立日光森林幼兒園,5e023ef3-1cf2-4351-919d-f8756a5a6677
高市教幼字第10138778400號高雄市私立優群幼兒園,3d3bcfc8-f41c-4f00-97e3-9149df0ce4c6
高市教幼字第10139086400號高雄市私立金貝兒幼兒園,58c8dfe7-e588-475e-935a-28202031e142
高市教幼字第10632303200號高雄市私立天使幼兒園,5fe3cfa1-3dcc-4ba1-bd1a-e407a46c9eb4
高市教幼字第10137919900號高雄市私立仁武同心園幼兒園,3770c9ba-079f-4eaa-a53d-aaa3438dfd96
高市教幼字第10335750100號高雄市私立光仁幼兒園,3c03717d-db6b-4d7e-847e-deb6345aac00
高市教幼字第10537108000號高雄市私立亨利幼兒園,bb07dd39-533c-4d56-b071-6d7a0c9fed7b
高市教幼字第10138455100號高雄市私立新資優生幼兒園,0f7cec27-3ad3-40e2-a779-73dec920eda5
高市教幼字第10535432700號高雄市私立及人幼兒園,7b08f855-7a56-4b5d-bf68-f6dc65ce4389
高市教幼字第10634949200號高雄市私立新思維幼兒園,fd8fe16c-e5bb-4d2d-aba8-2419216781e7
高市教幼字第10838118800號高雄市私立仁武保進國際藝術幼兒園,48dbccc3-17a6-454f-bfaf-d2713bb5c3a7
高市教幼字第11131299500號高雄市私立彼得魚幼兒園,fe6dc391-305a-4074-8f27-ff1a2d0bb66b
高市教幼字第11034819200號高雄市私立常春藤仁武幼兒園,bc460930-0f69-42d1-bf99-976c5199e2f5
高市教幼字第11132671700號高雄市私立帝伊幼兒園,2f01a85e-2ec5-4a64-ae43-12208d2fdc30
高市教幼字第10936944700號高雄市大社區大社國民小學附設幼兒園,79aaea03-6b60-4f7a-9754-5dc8455f730f
高市教幼字第10937705000號高雄市大社區觀音國民小學附設幼兒園,17edfc3d-f9fe-451a-907d-502cde7fd05e
高市教幼字第10937973400號高雄市私立芌全幼兒園,a5f97fb2-165b-41c5-85d1-45579542961c
高市教幼字第10138481000號高雄市私立佳芳幼兒園,072287c6-46e8-4256-9bfb-a740e4cc9a7d
高市教幼字第10138482200號高雄市私立小太陽菁英幼兒園,a710a1b8-173c-4c80-a28c-39ef7750c75d
高市教幼字第11038806900號高雄市私立甜甜圈幼兒園,ab53a21b-270c-424d-b787-0c2ed7e2e537
高市教幼字第11036457300號高雄市大社非營利幼兒園,e7db49ef-cf4f-485d-bb0f-b58094229bb3
高市教幼字第11037407600號高雄市岡山區嘉興國民小學附設幼兒園,e216e769-c56a-4df4-a854-7f9b12d8d6d9
高市教幼字第10735481700號高雄市岡山區和平國民小學附設幼兒園,cc3da96f-370e-4b52-8c27-3508888b45de
高市教幼字第10835624100號高雄市岡山區前峰國民小學附設幼兒園,ff86f512-55c8-4d4c-8116-7abafb2da039
高市教幼字第10337219100號高雄市岡山區岡山國民小學附設幼兒園,58b2dd47-c35a-414a-96d9-82f24df74ca3
高市教幼字第10436349700號高雄市岡山區兆湘國民小學附設幼兒園,aae88ffc-33c0-4580-96be-35d3d0ae64c7
高市教幼字第10936697100號高雄市岡山區後紅國民小學附設幼兒園,2ed6431b-2e11-4c5d-aac8-117e62d7e55d
高市教幼字第10335816400號高雄市私立親民幼兒園,8242c64b-0cfc-49cb-a91f-a617e027b0d5
高市教幼字第10138468900號高雄市私立新長榮幼兒園,f595706a-4a20-4107-a963-7a908bcb6e4a
高市教幼字第10132984800號高雄市私立長榮幼兒園,26aac8fb-17ec-4cd8-9e71-c4c569f8845f
高市教幼字第11037170700號高雄市私立幼一幼兒園,51fabc0f-e43f-4466-bdfa-8748ad3f0a43
高市教幼字第10137586700號高雄市私立時代幼兒園,1f8f0195-04e8-4d0f-aa19-4c9f6d5304ca
高市教幼字第10834934400號高雄市私立羽生幼兒園,2efe7814-ea44-4287-844c-90ac90b0c81e
高市教幼字第10139371400號高雄市私立史丹佛幼兒園,cdbb09b9-0fd6-4e2b-9120-e93f44387bb0
高市教幼字第10237544700號高雄市私立多多幼兒園,5375883a-20a3-40d3-a826-eaec702221ff
高市教幼字第10139074800號高雄市私立小天才幼兒園,5612652e-5519-48fd-b2d2-24b215c0b5e4
高市教幼字第10137448900號高雄市私立慈惠幼兒園,6bbb6d4f-22e0-40f4-91fc-8c8951ce72f2
高市教幼字第10638026000號高雄市私立主人翁幼兒園,b3f501e4-6b31-4531-aef3-41737191cff1
高市教幼字第10335968300號高雄市私立偉倫幼兒園,44b35604-f1c0-494b-ad83-9d02c5c45734
高市教幼字第10138301700號高雄市私立高苑幼兒園,80fd9e14-41cb-4caa-84ec-a72e1d2a09fd
高市教幼字第10138073800號高雄市私立華崗幼兒園,6297f650-d78a-4d36-8080-616aee8373d1
高市教幼字第10137923800號高雄市私立愛森堡幼兒園,0e8b2ca1-ec07-4854-a493-a65c32468ba5
高市教幼字第10138516200號高雄市私立台上幼兒園,bf3097f5-1595-4d29-a8d7-5fe5b3f43235
高市教幼字第10833196200號高雄市岡山區大後協社區發展協會附設高雄市私立幼兒園,aa45e37f-41d9-47b4-9dc5-40b7b68f68d8
高市教幼字第10435402100號高雄市私立岡山保進幼兒園,7ba3c2c5-451f-4ff0-82fb-59578f464cd6
高市教幼字第10331227200號高雄市私立欣園幼兒園,5b4884d2-c347-4920-a610-6436d1a2999a
高市教幼字第10138851900號高雄市私立貝斯特幼兒園,defd1baa-9b2a-4f12-bed1-e8999904ee91
高市教幼字第11033981200號高雄市私立欣容幼兒園,687e0965-2482-4001-8c03-9c78fd637f80
高市教幼字第10631622900號高雄市私立新安心幼兒園,1055978e-8b20-4867-ad4e-6c4b1377b7fc
高市教幼字第10138870900號高雄市私立玉慈幼兒園,cee9d49d-09df-4b99-a6a2-1633c6702ac0
高市教幼字第10938903700號高雄市私立綠色森林幼兒園,6d24382c-a238-4d0f-a38a-69168c59c3fc
高市教幼字第10835232100號高雄市岡山非營利幼兒園,cbce1750-6a9f-410e-bdcd-26c3c4051a73
高市教幼字第11036022800號高雄市後紅非營利幼兒園,30115c8e-4c03-45be-b13e-4faa6f893ae6
高市教幼字第11037181800號高雄市岡中非營利幼兒園(委託社團法人高雄市童馨關懷成長協會辦理),d055387c-4bad-4ccc-a126-483f12a0434b
高市教幼字第11036120800號高雄市路竹區路竹國民小學附設幼兒園,6a067d15-1369-4567-bafb-4658d0d80001
高市教幼字第11037410800號高雄市路竹區大社國民小學附設幼兒園,d53b970a-d553-4c2f-8284-725ceb392948
高市教幼字第11131323500號高雄市路竹區三埤國民小學附設幼兒園,794d2d10-bce0-45b9-8940-b695fe74f2b1
高市教幼字第10937691200號高雄市路竹區竹滬國民小學附設幼兒園,ee30c9ed-85a2-4280-8a7a-5986cab0db81
高市教幼字第10636933600號高雄市路竹區蔡文國民小學附設幼兒園,4cd45e65-ee0b-434f-818b-e7cd87b3c98d
高市教幼字第10835390300號高雄市路竹區北嶺國民小學附設幼兒園,1148510c-0cde-4e93-b41f-785d31acd613
高市教幼字第11037224900號高雄市路竹區下坑國民小學附設幼兒園,33153e8f-02e0-4cf4-997f-48640466fead
高市教幼字第10835817500號高雄市路竹區一甲國民小學附設幼兒園,eb502f1f-1917-4df1-9d2b-b61d46fe4b63
高市教幼字第10936830400號高雄市立路竹幼兒園,03b33768-a280-4e44-9e26-55b07170a489
高市教幼字第10132504400號高雄市私立孟莊幼兒園,1c6b9000-6dcc-44ca-a5aa-35e6bc7d6552
高市教幼字第10333869900號高雄市私立瑞生幼兒園,00a369e5-99e5-42d1-ae82-38a30eb28416
高市教幼字第10531935500號高雄市私立一新幼兒園,20fc0734-5e7f-48f4-b8b6-d32b8f1dffeb
高市教幼字第10139371500號高雄市私立吉米洛幼兒園,02263d6b-3dd6-49e2-9372-0a0e0c0e8636
高市教幼字第10138309600號高雄市私立康乃爾藝術幼兒園,cd5ec558-0d67-4a1b-9b5c-14224399cbbb
高市教幼字第10137812600號高雄市私立寶仁幼兒園,fb8e4ccb-1476-409e-a111-5e839b04a7e1
高市教幼字第10138683600號高雄市私立創意幼兒園,8446bec2-b4ea-4990-b7e7-ccc23a164f60
高市教幼字第11037399700號高雄市私立新孟莊幼兒園,4b4d2518-4727-4649-b6a1-1ee0ab8ef1c9
高市教幼字第10934131900號高雄市私立冠均幼兒園,a4cf5a04-63be-46d5-803c-e889588b0af7
高市教幼字第11132837000號高雄市私立子欣幼兒園,87939467-afc8-4b10-80cf-02d86dcc0ca1
高市教幼字第10939718500號高雄市阿蓮區阿蓮國民小學附設幼兒園,121dcd27-42b6-402a-aa6a-130b6a3dbeaf
高市教幼字第10936650500號高雄市阿蓮區中路國民小學附設幼兒園,8a6b3f03-53a5-4449-9b2b-84735d3a1063
高市教幼字第10835669300號高雄市阿蓮區復安國民小學附設幼兒園,94c51eee-f627-4799-a06f-deb69bb3a8ce
高市教幼字第10132081800號高雄市私立培幼幼兒園,f360247d-86ff-4cb0-bae6-f69c9e1527b4
高市教幼字第11032016700號高雄市私立劍橋幼兒園,0bda7f9b-bcc2-4582-9922-cd897c87c9e5
高市教幼字第10137822600號高雄市私立智慧星幼兒園,323ab10a-1cf9-4489-a09b-7f7f8e855fe4
高市教幼字第10137988800號高雄市私立小可愛幼兒園,3d2fd793-ea5c-4731-88ce-4e980d4ec389
高市教幼字第10138517600號高雄市私立童心藝術幼兒園,f3b40af1-1484-4eb5-ac87-8ec83536f44a
高市教幼字第11130257800號高雄市私立可愛幼兒園,120968f9-0648-4063-bd9f-fdd9b58a3941
高市教幼字第11036976400號高雄市田寮區新興國民小學附設幼兒園,e86a912c-ec3d-4733-a635-8079ca9e539d
高市教幼字第10936697000號高雄市田寮區崇德國民小學附設幼兒園,1d65bbd7-f9f0-43c3-932e-e7c52416b739
高市教幼字第10736000100號高雄市燕巢區橫山國民小學附設幼兒園,1de99a13-85e4-40da-9e23-65aa3f3d0b94
高市教幼字第10937882800號高雄市燕巢區鳳雄國民小學附設幼兒園,e50ca7ac-8a44-473f-95ba-b9bcbd2cb1dd
高市教幼字第10937244400號高雄市燕巢區燕巢國民小學附設幼兒園,f4e1cccb-10ee-4183-ba7d-aedc345a1f99
高市教幼字第10937689800號高雄市燕巢區安招國民小學附設幼兒園,09d2da5b-c55b-4541-916a-2963e0f6e897
