point,area,type,months,total1,total2,monthly1,monthly2
國立彰化特殊教育學校幼兒部,社頭鄉,公立,10,34600,0,3460,0
彰化基督教醫院職工福利委員會附設彰化縣私立彰基幼兒園,彰化市,私立,12,155800,0,12983,0
彰化縣二林鎮立幼兒園,二林鎮,公立,10,43700,0,4370,0
彰化縣二水鄉二水國民小學附設幼兒園,二水鄉,公立,8,28070,0,3509,0
彰化縣二水鄉立幼兒園,二水鄉,公立,10,38400,0,3840,0
彰化縣伸仁非營利幼兒園（委託社團法人大中華社會企業創新策略發展協會辦理）,伸港鄉,非營利,12,112608,0,9384,0
彰化縣僑愛非營利幼兒園（委託社團法人彰化縣中華幼兒教保職涯發展協會辦理）,花壇鄉,非營利,12,111000,0,9250,0
彰化縣北斗鎮立幼兒園,北斗鎮,公立,10,39600,8000,3960,800
彰化縣國聖非營利幼兒園（委託社團法人彰化縣全方位教育協會辦理）,彰化市,非營利,12,112608,0,9384,0
彰化縣埤頭鄉立幼兒園,埤頭鄉,公立,10,44550,0,4455,0
彰化縣大村鄉立幼兒園,大村鄉,公立,10,37800,3000,3780,300
彰化縣大村鄉立幼兒園大村一分班,大村鄉,公立,10,37800,3000,3780,300
彰化縣平和非營利幼兒園（委託社團法人彰化縣中華幼兒教保職涯發展協會辦理）,彰化市,非營利,12,108384,0,9032,0
彰化縣彰化市立幼兒園,彰化市,公立,8,42000,0,5250,0
彰化縣彰山宮文化慈善事業協會附設彰化縣私立彰山宮幼兒園,彰化市,準公共化,12,76476,9000,6373,750
彰化縣溪湖鎮立幼兒園,溪湖鎮,公立,10,43200,0,4320,0
彰化縣溪湖鎮立幼兒園大庭分班,溪湖鎮,公立,10,43200,0,4320,0
彰化縣溪湖鎮立幼兒園湳底分班,溪湖鎮,公立,10,43200,0,4320,0
彰化縣溪湖鎮立幼兒園田中分班,溪湖鎮,公立,10,43200,0,4320,0
彰化縣石牌非營利幼兒園（委託社團法人彰化縣中華幼兒教保職涯發展協會辦理）,彰化市,非營利,12,130704,0,10892,0
彰化縣私立一勤幼兒園,員林市,準公共化,12,62400,9000,5200,750
彰化縣私立一家人完全幼兒園,花壇鄉,準公共化,12,100836,9600,8403,800
彰化縣私立三才幼兒園,彰化市,準公共化,12,125324,9600,10444,800
彰化縣私立上鼎幼兒園,彰化市,私立,12,124800,0,10400,0
彰化縣私立九個果子幼兒園,員林市,私立,12,83000,0,6917,0
彰化縣私立亮亮幼兒園,伸港鄉,私立,12,98400,0,8200,0
彰化縣私立仁仁幼兒園,田尾鄉,準公共化,12,96600,9000,8050,750
彰化縣私立佳新幼兒園,北斗鎮,準公共化,12,109872,0,9156,0
彰化縣私立來來幼兒園,芬園鄉,私立,12,66000,0,5500,0
彰化縣私立儒林幼兒園,二林鎮,準公共化,12,96870,9000,8073,750
彰化縣私立優格林幼兒園,二林鎮,私立,12,72000,0,6000,0
彰化縣私立先鋒幼兒園,彰化市,準公共化,12,105528,9600,8794,800
彰化縣私立光華幼兒園,二林鎮,準公共化,12,94720,0,7893,0
彰化縣私立劍橋幼兒園,秀水鄉,私立,12,118800,24000,9900,2000
彰化縣私立劍聲幼兒園,彰化市,準公共化,12,136324,9000,11360,750
彰化縣私立勁寶兒東興幼兒園,員林市,私立,12,150000,0,12500,0
彰化縣私立勁寶兒海頓幼兒園,彰化市,私立,12,144000,0,12000,0
彰化縣私立北斗育心幼兒園,北斗鎮,準公共化,12,107280,9600,8940,800
彰化縣私立南興幼兒園,彰化市,準公共化,12,117816,9000,9818,750
彰化縣私立博思特幼兒園,和美鎮,準公共化,12,131760,9000,10980,750
彰化縣私立台大幼兒園,伸港鄉,私立,12,87600,0,7300,0
彰化縣私立史丹福幼兒園,和美鎮,私立,12,114000,0,9500,0
彰化縣私立吉的堡中興幼兒園,彰化市,私立,12,144000,0,12000,0
彰化縣私立同心幼兒園,員林市,私立,12,132000,0,11000,0
彰化縣私立名人幼兒園,員林市,準公共化,12,107732,9000,8978,750
彰化縣私立名威幼兒園,田尾鄉,私立,12,103600,0,8633,0
彰化縣私立名晟幼兒園,溪湖鎮,準公共化,12,103616,9000,8635,750
彰化縣私立和平幼兒園,彰化市,準公共化,12,109512,9600,9126,800
彰化縣私立和德幼兒園,秀水鄉,私立,12,121000,0,10083,0
彰化縣私立和欣幼兒園,埤頭鄉,準公共化,12,95328,9000,7944,750
彰化縣私立和美保進幼兒園,和美鎮,準公共化,12,139200,9600,11600,800
彰化縣私立哈佛幼兒園,秀水鄉,準公共化,12,111264,9000,9272,750
彰化縣私立哈羅蒙特梭利幼兒園,花壇鄉,私立,12,162800,0,13567,0
彰化縣私立員林保進幼兒園,員林市,私立,12,134400,9600,11200,800
彰化縣私立員林諾貝爾幼兒園,員林市,私立,12,79480,0,6623,0
彰化縣私立喜巧兒幼兒園,員林市,私立,12,132000,0,11000,0
彰化縣私立喜悅兒幼兒園,彰化市,私立,12,108000,0,9000,0
彰化縣私立喜悅兒曉陽幼兒園,彰化市,私立,12,108000,0,9000,0
彰化縣私立喬森幼兒園,大村鄉,準公共化,12,100548,9000,8379,750
彰化縣私立嘉人幼兒園,鹿港鎮,私立,12,206320,0,17193,0
彰化縣私立嘉年華幼兒園,田尾鄉,準公共化,12,109068,9000,9089,750
彰化縣私立嘉貝幼兒園,田中鎮,準公共化,12,106180,9000,8848,750
彰化縣私立嘟嘟幼兒園,彰化市,私立,12,96000,0,8000,0
彰化縣私立四季熊幼兒園,員林市,準公共化,12,138000,9600,11500,800
彰化縣私立培根幼兒園,彰化市,私立,12,190000,48000,15833,4000
彰化縣私立堉惠幼兒園,彰化市,私立,12,96000,0,8000,0
彰化縣私立多多隆幼兒園,福興鄉,私立,12,84000,0,7000,0
彰化縣私立大員林合家歡幼兒園,員林市,私立,12,87000,0,7250,0
彰化縣私立大村安麒兒幼兒園,大村鄉,準公共化,12,104624,4800,8719,400
彰化縣私立大統幼兒園,埤頭鄉,準公共化,12,114612,9000,9551,750
彰化縣私立大自然幼兒園,社頭鄉,私立,12,98000,0,8167,0
彰化縣私立大衛營幼兒園,員林市,私立,12,157200,0,13100,0
彰化縣私立天晴幼兒園,埔心鄉,準公共化,12,176400,9600,14700,800
彰化縣私立天民幼兒園,溪湖鎮,私立,12,84000,0,7000,0
彰化縣私立天真幼兒園,鹿港鎮,私立,12,127200,0,10600,0
彰化縣私立奇貝兒幼兒園,和美鎮,私立,12,96000,0,8000,0
彰化縣私立威爾森幼兒園,彰化市,私立,12,87600,0,7300,0
彰化縣私立安安幼兒園,鹿港鎮,私立,12,90208,0,7517,0
彰化縣私立安安廣學幼兒園,鹿港鎮,私立,12,88958,0,7413,0
彰化縣私立安祈兒幼兒園,福興鄉,準公共化,12,102604,9000,8550,750
彰化縣私立安貝兒幼兒園,彰化市,私立,12,94400,0,7867,0
彰化縣私立安迪生幼兒園,溪湖鎮,私立,12,96000,0,8000,0
彰化縣私立富樂比幼兒園,伸港鄉,準公共化,12,96480,9000,8040,750
彰化縣私立富蘭克林幼兒園,彰化市,私立,12,190000,48000,15833,4000
彰化縣私立寶寶幼兒園,永靖鄉,私立,12,120000,0,10000,0
彰化縣私立寶貝幼兒園,永靖鄉,準公共化,12,101100,9000,8425,750
彰化縣私立小博士幼兒園,和美鎮,準公共化,12,103844,9000,8654,750
彰化縣私立小叮噹幼兒園,和美鎮,準公共化,12,122428,9000,10202,750
彰化縣私立小天使幼兒園,鹿港鎮,準公共化,12,118104,9000,9842,750
彰化縣私立小太陽幼兒園,和美鎮,準公共化,12,81216,9000,6768,750
彰化縣私立小學儒品格幼兒園,社頭鄉,準公共化,12,123792,9000,10316,750
彰化縣私立小牛津幼兒園,埔心鄉,準公共化,12,85664,9000,7139,750
彰化縣私立小豆豆幼兒園,北斗鎮,準公共化,12,97764,9000,8147,750
彰化縣私立山姆叔叔幼兒園,彰化市,準公共化,12,129324,9000,10777,750
彰化縣私立巧冠幼兒園,埔鹽鄉,準公共化,12,105256,9000,8771,750
彰化縣私立巧宜家幼兒園,和美鎮,準公共化,12,84288,9000,7024,750
彰化縣私立幼安幼兒園,福興鄉,準公共化,12,143640,9000,11970,750
彰化縣私立幼幼幼兒園,彰化市,準公共化,12,87168,9000,7264,750
彰化縣私立幼幼皇家幼兒園,彰化市,私立,12,102000,6000,8500,500
彰化縣私立幼愛幼兒園,伸港鄉,私立,12,62200,0,5183,0
彰化縣私立幼祥幼兒園,彰化市,準公共化,12,128628,8400,10719,700
彰化縣私立弘明幼兒園,員林市,私立,12,132000,0,11000,0
彰化縣私立強森幼兒園,北斗鎮,準公共化,12,107196,9000,8933,750
彰化縣私立強森永靖幼兒園,永靖鄉,準公共化,12,107304,12000,8942,1000
彰化縣私立彩虹屋幼兒園,溪湖鎮,私立,12,110670,0,9223,0
彰化縣私立彰化弘明幼兒園,和美鎮,私立,12,132000,0,11000,0
彰化縣私立微笑幼兒園,員林市,私立,12,75600,0,6300,0
彰化縣私立志安幼兒園,溪湖鎮,私立,12,102000,0,8500,0
彰化縣私立快樂學校幼兒園,芳苑鄉,私立,12,64600,0,5383,0
彰化縣私立快樂寶貝中正幼兒園,大村鄉,私立,12,108000,0,9000,0
彰化縣私立快樂寶貝幼兒園,大村鄉,私立,12,108000,0,9000,0
彰化縣私立惠泉幼兒園,員林市,私立,12,168800,48000,14067,4000
彰化縣私立愛丁堡幼兒園,員林市,私立,12,133000,0,11083,0
彰化縣私立愛兒幼兒園,秀水鄉,私立,12,111600,0,9300,0
彰化縣私立愛婗幼兒園,員林市,準公共化,12,168096,9000,14008,750
彰化縣私立愛笛兒幼兒園,田中鎮,準公共化,12,133296,9000,11108,750
彰化縣私立愛米亞幼兒園,伸港鄉,私立,12,96000,0,8000,0
彰化縣私立慈愛幼兒園,員林市,準公共化,12,107520,9600,8960,800
彰化縣私立成功幼兒園,溪湖鎮,私立,12,126000,0,10500,0
彰化縣私立探索幼兒園,彰化市,準公共化,12,123000,9600,10250,800
彰化縣私立探索東谷幼兒園,和美鎮,私立,12,123000,9600,10250,800
彰化縣私立探索辭修幼兒園,彰化市,私立,12,117600,9600,9800,800
彰化縣私立教育家幼兒園,溪湖鎮,私立,12,126000,0,10500,0
彰化縣私立文揚幼兒園,二林鎮,準公共化,12,98136,9000,8178,750
彰化縣私立旗艦史丹福幼兒園,彰化市,私立,12,126000,0,10500,0
彰化縣私立日光城堡幼兒園,彰化市,私立,12,191450,0,15954,0
彰化縣私立日光幼兒園,大村鄉,準公共化,12,78000,9000,6500,750
彰化縣私立昀銛幼兒園,彰化市,準公共化,12,82608,9000,6884,750
彰化縣私立昕鉅陽幼兒園,溪湖鎮,私立,10,141000,0,14100,0
彰化縣私立普林斯頓幼兒園,鹿港鎮,私立,12,90000,0,7500,0
彰化縣私立望達福幼兒園,永靖鄉,準公共化,12,100056,9600,8338,800
彰化縣私立杜威幼兒園,員林市,準公共化,12,121644,9000,10137,750
彰化縣私立東亞園幼兒園,花壇鄉,私立,12,96600,0,8050,0
彰化縣私立東森幼兒園,永靖鄉,準公共化,12,73908,9000,6159,750
彰化縣私立柏克萊幼兒園,鹿港鎮,私立,12,99400,0,8283,0
彰化縣私立格林幼兒園,彰化市,私立,12,131200,9600,10933,800
彰化縣私立格瑞特幼兒園,彰化市,準公共化,12,76796,9000,6400,750
彰化縣私立梅花幼兒園,伸港鄉,私立,12,92400,0,7700,0
彰化縣私立森田國際幼兒園,伸港鄉,準公共化,12,156000,9600,13000,800
彰化縣私立榮星幼兒園,田中鎮,私立,12,96000,0,8000,0
彰化縣私立樂育幼兒園,員林市,準公共化,12,109752,9000,9146,750
彰化縣私立樹人幼兒園,彰化市,私立,12,96000,0,8000,0
彰化縣私立永育幼兒園,二林鎮,準公共化,12,120972,9600,10081,800
彰化縣私立永靖安琪爾幼兒園,永靖鄉,準公共化,12,90084,9000,7507,750
彰化縣私立溪湖保進幼兒園,溪湖鎮,準公共化,12,115524,9000,9627,750
彰化縣私立溫徹斯特幼兒園,永靖鄉,準公共化,12,108708,9000,9059,750
彰化縣私立爵諾威爾幼兒園,彰化市,私立,12,114000,0,9500,0
彰化縣私立爵諾麗森幼兒園,彰化市,私立,12,109200,0,9100,0
彰化縣私立牛頓幼兒園,秀水鄉,準公共化,12,108492,9600,9041,800
彰化縣私立牛頓米羅幼兒園,彰化市,私立,12,96000,0,8000,0
彰化縣私立獅子王幼兒園,埔鹽鄉,準公共化,12,121644,9600,10137,800
彰化縣私立理想園幼兒園,北斗鎮,準公共化,12,127056,9000,10588,750
彰化縣私立田中成長幼兒園,田中鎮,準公共化,12,84064,9000,7005,750
彰化縣私立發現藝術幼兒園,和美鎮,準公共化,12,119748,9000,9979,750
彰化縣私立皇家幼兒園,鹿港鎮,準公共化,12,138160,9000,11513,750
彰化縣私立社頭小太陽幼兒園,社頭鄉,私立,12,99600,0,8300,0
彰化縣私立福安幼兒園,秀水鄉,準公共化,12,127166,9000,10597,750
彰化縣私立福瑞斯特國際藝術幼兒園,員林市,準公共化,12,143576,9000,11965,750
彰化縣私立福興文開幼兒園,福興鄉,私立,12,100100,0,8342,0
彰化縣私立種籽蒙特梭利幼兒園,員林市,私立,12,148000,0,12333,0
彰化縣私立稻盛幼兒園,花壇鄉,私立,12,192000,9600,16000,800
彰化縣私立空間幼兒園,溪湖鎮,私立,12,137000,0,11417,0
彰化縣私立立人幼兒園,彰化市,準公共化,12,113028,9600,9419,800
彰化縣私立立大幼兒園,彰化市,私立,12,110600,24000,9217,2000
彰化縣私立童年幼兒園,彰化市,私立,12,70800,0,5900,0
彰化縣私立童林幼兒園,鹿港鎮,私立,12,121200,0,10100,0
彰化縣私立籃虹幼兒園,二林鎮,私立,12,114000,0,9500,0
彰化縣私立米堤爾幼兒園,彰化市,私立,12,77600,0,6467,0
彰化縣私立米强生幼兒園,和美鎮,準公共化,12,110316,9000,9193,750
彰化縣私立精英幼兒園,社頭鄉,準公共化,12,124920,9600,10410,800
彰化縣私立約克幼兒園,和美鎮,私立,12,92000,0,7667,0
彰化縣私立經典幼兒園,員林市,私立,12,185000,48000,15417,4000
彰化縣私立綠太陽幼兒園,溪湖鎮,準公共化,12,117852,9600,9821,800
彰化縣私立維多利亞幼兒園,秀水鄉,私立,12,122000,0,10167,0
彰化縣私立維格幼兒園,溪州鄉,準公共化,12,144000,9000,12000,750
彰化縣私立美兒堡幼兒園,花壇鄉,準公共化,12,131632,9000,10969,750
彰化縣私立美利亞幼兒園,彰化市,準公共化,12,117512,9000,9793,750
彰化縣私立耕心園幼兒園,鹿港鎮,私立,12,136000,0,11333,0
彰化縣私立耕新幼兒園,彰化市,準公共化,12,120432,9000,10036,750
彰化縣私立聖保羅幼兒園,和美鎮,私立,12,126000,9600,10500,800
彰化縣私立聖愛幼兒園,芳苑鄉,準公共化,12,128400,9000,10700,750
彰化縣私立育仁幼兒園,花壇鄉,私立,10,101500,0,10150,0
彰化縣私立育光幼兒園,員林市,私立,12,168800,48000,14067,4000
彰化縣私立育兒福幼兒園,大村鄉,私立,12,85200,0,7100,0
彰化縣私立育成幼兒園,花壇鄉,準公共化,12,142380,9000,11865,750
彰化縣私立艾奇德幼兒園,員林市,私立,12,130600,0,10883,0
彰化縣私立芝加哥幼兒園,彰化市,私立,12,117600,0,9800,0
彰化縣私立芝麻街大村幼兒園,大村鄉,準公共化,12,127592,9600,10633,800
彰化縣私立芝麻街幼兒園,二林鎮,準公共化,12,145200,12000,12100,1000
彰化縣私立芳苑鄉立示範幼兒園（彰化縣芳苑鄉公所委託彰化縣私立芝麻街幼兒園辦理）,芳苑鄉,準公共化,12,86580,9600,7215,800
彰化縣私立英倫幼兒園,和美鎮,私立,12,96000,0,8000,0
彰化縣私立英橋幼兒園,秀水鄉,私立,12,109000,24000,9083,2000
彰化縣私立華桀幼兒園,北斗鎮,準公共化,12,105348,9000,8779,750
彰化縣私立華盛頓幼兒園,彰化市,私立,12,90000,0,7500,0
彰化縣私立萊恩幼兒園,花壇鄉,準公共化,12,107240,9000,8937,750
彰化縣私立薇尼爾幼兒園,和美鎮,私立,12,144800,0,12067,0
彰化縣私立西門幼兒園,溪湖鎮,私立,12,109000,0,9083,0
彰化縣私立親親幼兒園,二水鄉,私立,12,87600,0,7300,0
彰化縣私立貝威幼兒園,花壇鄉,準公共化,12,89672,0,7473,0
彰化縣私立貝斯特幼兒園,鹿港鎮,私立,12,132000,9600,11000,800
彰化縣私立貝比幼兒園,北斗鎮,準公共化,12,136080,9000,11340,750
彰化縣私立資優幼兒園,社頭鄉,私立,12,114000,9600,9500,800
彰化縣私立迪士尼幼兒園,員林市,準公共化,12,107736,9600,8978,800
彰化縣私立迪士尼莒光幼兒園,員林市,準公共化,12,108792,9600,9066,800
彰化縣私立重愛幼兒園,田中鎮,私立,10,105000,0,10500,0
彰化縣私立鉅陽幼兒園,溪湖鎮,私立,10,141000,0,14100,0
彰化縣私立長頸鹿幼兒園,花壇鄉,私立,12,58400,0,4867,0
彰化縣私立長頸鹿幼兒園成功分班,花壇鄉,私立,12,58400,0,4867,0
彰化縣私立陳姊姊幼兒園,田中鎮,私立,12,102000,0,8500,0
彰化縣私立陳興幼兒園,彰化市,準公共化,12,100576,9000,8381,750
彰化縣私立陽明幼兒園,員林市,私立,12,78240,0,6520,0
彰化縣私立青青幼兒園,埤頭鄉,準公共化,12,98232,9000,8186,750
彰化縣私立頂尖保進幼兒園,彰化市,準公共化,12,113700,9000,9475,750
彰化縣私立領袖幼兒園,北斗鎮,私立,12,90200,0,7517,0
彰化縣私立鵝媽媽幼兒園,彰化市,準公共化,12,156424,9600,13035,800
彰化縣私立鹿港保進幼兒園,鹿港鎮,準公共化,12,115588,9600,9632,800
彰化縣私立鹿港多多龍幼兒園,鹿港鎮,私立,12,80000,0,6667,0
彰化縣立原斗國民中小學附設幼兒園,二林鎮,公立,8,28820,0,3603,0
彰化縣竹塘鄉立幼兒園,竹塘鄉,公立,10,40700,0,4070,0
彰化縣育英非營利幼兒園（委託社團法人彰化縣全方位教育協會辦理）,員林市,非營利,12,112608,0,9384,0
彰化縣芬園鄉立幼兒園,芬園鄉,公立,10,43590,0,4359,0
明道學校財團法人明道大學附設彰化縣私立明道幼兒園,埤頭鄉,私立,12,148000,0,12333,0
有限責任國立員林高級家事商業職業學校員生消費合作社附設彰化縣私立員家幼兒園,員林市,私立,10,95500,200,9550,20
有限責任國立彰化師範大學員生消費合作社附設彰化縣私立彰師大幼兒園,彰化市,私立,12,134800,0,11233,0
財團法人天主教會台中教區附設彰化縣私立聖神幼兒園,北斗鎮,準公共化,12,97728,9000,8144,750
