point,area,type,months,total,monthly
中道學校財團法人宜蘭縣中道高級中學附設宜蘭縣私立中道幼兒園,壯圍鄉,私立,12,165000,13750
國立頭城高級家事商業職業學校附設宜蘭縣私立幼兒園,頭城鎮,準公共化,12,107448,8954
宜蘭縣三星鄉立幼兒園,三星鄉,公立,12,39790,3316
宜蘭縣三星鄉立幼兒園拱照分班,三星鄉,公立,12,39790,3316
宜蘭縣五結鄉立幼兒園,五結鄉,公立,10,44760,4476
宜蘭縣五結鄉立幼兒園利澤分班,五結鄉,公立,10,44760,4476
宜蘭縣光復非營利幼兒園(委託財團法人靖娟兒童安全文教基金會辦理),宜蘭市,非營利,12,100668,8389
宜蘭縣冬山鄉冬山國民小學附設幼兒園,冬山鄉,公立,8,24896,3112
宜蘭縣冬山鄉立幼兒園,冬山鄉,公立,12,35163,2930
宜蘭縣冬山鄉立幼兒園中山分班,冬山鄉,公立,12,31784,2649
宜蘭縣冬山鄉順安國民小學附設幼兒園,冬山鄉,公立,8,24896,3112
宜蘭縣南澳鄉東澳國民小學附設幼兒園,南澳鄉,公立,8,24896,3112
宜蘭縣南澳鄉澳花國民小學附設幼兒園,南澳鄉,公立,8,24896,3112
宜蘭縣南澳鄉立幼兒園,南澳鄉,公立,10,39000,3900
宜蘭縣南澳鄉立幼兒園武塔分班,南澳鄉,公立,10,39000,3900
宜蘭縣南澳鄉立幼兒園碧候分班,南澳鄉,公立,10,39000,3900
宜蘭縣南澳鄉立幼兒園金洋分班,南澳鄉,公立,10,39000,3900
宜蘭縣員山鄉立幼兒園,員山鄉,公立,10,42400,4240
宜蘭縣壯圍鄉古亭國民小學附設幼兒園,壯圍鄉,公立,8,24446,3056
宜蘭縣壯圍非營利幼兒園(委託社團法人宜蘭縣蘭陽幼兒教保事業發展協會辦理),壯圍鄉,非營利,12,104316,8693
宜蘭縣大同鄉南山國民小學附設幼兒園,大同鄉,公立,8,24446,3056
宜蘭縣大同鄉四季國民小學附設幼兒園英士分班,大同鄉,公立,8,24716,3090
宜蘭縣大同鄉立幼兒園,大同鄉,公立,10,30000,3000
宜蘭縣大同鄉立幼兒園四季分班,大同鄉,公立,10,30000,3000
宜蘭縣大同鄉立幼兒園松羅分班,大同鄉,公立,10,30000,3000
宜蘭縣大同鄉立幼兒園樂水分班,大同鄉,公立,10,30000,3000
宜蘭縣大湖非營利幼兒園(委託財團法人靖娟兒童安全文教基金會辦理),員山鄉,非營利,12,106644,8887
宜蘭縣大隱非營利幼兒園(委託財團法人聖母醫護管理專科學校設立之聖母醫護管理專科學校辦理),三星鄉,非營利,12,109368,9114
宜蘭縣宜蘭市中山國民小學附設幼兒園,宜蘭市,公立,8,24896,3112
宜蘭縣宜蘭市凱旋國民小學附設幼兒園,宜蘭市,公立,8,25096,3137
宜蘭縣宜蘭市力行國民小學附設幼兒園,宜蘭市,公立,8,24896,3112
宜蘭縣宜蘭市南屏國民小學附設幼兒園,宜蘭市,公立,8,24896,3112
宜蘭縣清溝非營利幼兒園(委託社團法人宜蘭縣小太陽幼兒教育發展協會辦理),冬山鄉,非營利,12,98616,8218
宜蘭縣礁溪鄉礁溪國民小學附設幼兒園,礁溪鄉,公立,8,25096,3137
宜蘭縣礁溪鄉立幼兒園,礁溪鄉,公立,10,37500,3750
宜蘭縣私立亞艾幼兒園,頭城鎮,準公共化,12,99084,8257
宜蘭縣私立何嘉仁幼兒園,宜蘭市,私立,12,176210,14684
宜蘭縣私立光樺幼兒園,羅東鎮,準公共化,12,167868,13989
宜蘭縣私立加楓幼兒園,宜蘭市,私立,12,257400,21450
宜蘭縣私立培爾傑特幼兒園,宜蘭市,私立,12,126000,10500
宜蘭縣私立大象幼兒園,冬山鄉,準公共化,12,119592,9966
宜蘭縣私立安康幼兒園,宜蘭市,私立,12,151200,12600
宜蘭縣私立安琪卡幼兒園,宜蘭市,準公共化,12,114976,9581
宜蘭縣私立小圓圓幼兒園,羅東鎮,準公共化,12,116300,9692
宜蘭縣私立小甜甜幼兒園,羅東鎮,準公共化,12,112272,9356
宜蘭縣私立康乃兒幼兒園,羅東鎮,私立,12,137200,11433
宜蘭縣私立康軒幼兒園,冬山鄉,準公共化,12,104632,8719
宜蘭縣私立快樂格林幼兒園,羅東鎮,準公共化,12,127032,10586
宜蘭縣私立惠幼幼兒園,蘇澳鎮,私立,12,74400,6200
宜蘭縣私立愛德福幼兒園,員山鄉,私立,12,114472,9539
宜蘭縣私立愛貝爾幼兒園,羅東鎮,私立,12,159600,13300
宜蘭縣私立愛迪生幼兒園,羅東鎮,私立,12,253400,21117
宜蘭縣私立慈心華德福幼兒園,冬山鄉,私立,10,174700,17470
宜蘭縣私立慈怡幼兒園,冬山鄉,準公共化,12,94288,7857
宜蘭縣私立欣欣幼兒園,蘇澳鎮,私立,12,116720,9727
宜蘭縣私立狄士尼幼兒園,頭城鎮,準公共化,12,126756,10563
宜蘭縣私立福爾摩莎幼兒園,羅東鎮,準公共化,12,142724,11894
宜蘭縣私立育立幼兒園,頭城鎮,準公共化,12,126528,10544
宜蘭縣私立育霖幼兒園,羅東鎮,準公共化,12,116988,9749
宜蘭縣私立菁英幼兒園,羅東鎮,私立,12,175610,14634
宜蘭縣私立菩提幼兒園,羅東鎮,準公共化,12,116532,9711
宜蘭縣私立薇閣幼兒園,蘇澳鎮,私立,12,60360,5030
宜蘭縣私立諾貝爾幼兒園,宜蘭市,私立,12,156200,13017
宜蘭縣私立赫伯特幼兒園,頭城鎮,準公共化,12,123492,10291
宜蘭縣私立達文西幼兒園,宜蘭市,準公共化,12,125420,10452
宜蘭縣私立長春藤幼兒園,宜蘭市,私立,12,122400,10200
宜蘭縣私立龍之堡幼兒園,羅東鎮,準公共化,12,174764,14564
宜蘭縣私立康寶爾幼兒園,宜蘭市,私立,12,133200,11100
宜蘭縣私立芝蔴村國際幼兒園,宜蘭市,私立,12,166600,13883
宜蘭縣私立芝蔴村幼兒園,羅東鎮,私立,12,166600,13883
宜蘭縣羅東鎮北成國民小學附設幼兒園,羅東鎮,公立,8,24896,3112
宜蘭縣羅東鎮立幼兒園,羅東鎮,公立,10,32600,3260
宜蘭縣羅東鎮立幼兒園北成分班,羅東鎮,公立,10,32600,3260
宜蘭縣華國非營利幼兒園(社團法人宜蘭縣蘭陽幼兒教保事業發展協會申請辦理),五結鄉,非營利,12,102828,8569
宜蘭縣蘇澳鎮立幼兒園,蘇澳鎮,公立,10,58050,5805
宜蘭縣頭城鎮立幼兒園,頭城鎮,公立,10,35800,3580
宜蘭縣頭城鎮頭城國民小學附設幼兒園,頭城鎮,公立,8,24896,3112
財團法人台灣基督長老教會宜蘭教會附設宜蘭縣私立愛育幼兒園,宜蘭市,私立,12,136400,11367
財團法人大三鬮慈惠寺附設宜蘭縣私立幼兒園,員山鄉,準公共化,12,89516,7460
財團法人天主教宜蘭救主修女會附設宜蘭縣私立汎米亞幼兒園,宜蘭市,私立,12,104000,8667
財團法人天主教會台北教區附設宜蘭縣私立博愛幼兒園,蘇澳鎮,私立,12,92400,7700
財團法人天主教蘭陽青年會附設宜蘭縣私立聖音幼兒園,羅東鎮,準公共化,12,119940,9995
財團法人天主教靈醫修女會附設宜蘭縣私立瑪利亞幼兒園,冬山鄉,準公共化,12,109892,9158
財團法人羅東高商教育基金會附設宜蘭縣私立幼兒園,羅東鎮,準公共化,12,95692,7974
醫療財團法人羅許基金會附設宜蘭縣私立博愛幼兒園,羅東鎮,準公共化,12,110696,9225
