point,area,type,months,total1,total2,monthly1,monthly2,total3
國立屏東科技大學附設屏東縣私立屏科大幼兒園,內埔鄉,私立,12,89400,0,7450,0,89400
屏東縣三地門鄉地磨兒國民小學附設幼兒園德文分班,三地門鄉,公立,9,25160,0,2796,0,25160
屏東縣三地門鄉立幼兒園,三地門鄉,公立,10,26000,0,2600,0,26000
屏東縣三地門鄉立幼兒園口社分班,三地門鄉,公立,10,26000,0,2600,0,26000
屏東縣三地門鄉立幼兒園青山分班,三地門鄉,公立,10,26000,0,2600,0,26000
屏東縣三地門鄉立幼兒園青葉分班,三地門鄉,公立,10,26000,0,2600,0,26000
屏東縣三地門鄉馬兒社區互助教保服務中心(三地門鄉馬兒社區發展協會),三地門鄉,私立,12,54878,0,4573,0,54878
屏東縣三多非營利幼兒園(委託社團法人高雄市碩苗社會教育關懷協會辦理),九如鄉,非營利,12,0,0,9650,0,115800
屏東縣仙吉非營利幼兒園(委託財團法人輔英科技大學設立之輔英科技大學辦理),新園鄉,非營利,12,0,0,9436,0,113232
屏東縣佳冬鄉立幼兒園,佳冬鄉,公立,11,40900,0,3718,0,40900
屏東縣來義鄉立幼兒園,來義鄉,公立,9,20300,0,2256,0,20300
屏東縣來義鄉立幼兒園義林分班,來義鄉,公立,9,20300,0,2256,0,20300
屏東縣光春非營利幼兒園（委託社團法人屏東縣宥薰教育協會辦理）,潮州鎮,非營利,12,0,0,8873,0,106476
屏東縣內埔鄉內埔國民小學附設幼兒園,內埔鄉,公立,9,34200,0,3800,0,34200
屏東縣四維非營利幼兒園(委託社團法人台灣公共托育協會辦理),萬丹鄉,非營利,12,0,0,8417,0,101004
屏東縣屏東市建國國民小學附設幼兒園,屏東市,公立,9,34440,200,3827,22,34440
屏東縣屏東復興非營利幼兒園(委託財團法人彭婉如文教基金會辦理),屏東市,非營利,12,0,0,8377,0,100524
屏東縣新埤鄉立幼兒園,新埤鄉,公立,12,43920,0,3660,0,43920
屏東縣春日鄉古華國民小學附設幼兒園,春日鄉,公立,9,27420,0,3047,0,27420
屏東縣東興非營利幼兒園(委託財團法人輔英科技大學設立之輔英科技大學辦理),東港鎮,非營利,12,0,0,9097,0,109164
屏東縣枋山鄉立幼兒園,枋山鄉,公立,10,25000,0,2500,0,25000
屏東縣枋山鄉立幼兒園加祿分班,枋山鄉,公立,10,25000,0,2500,0,25000
屏東縣枋山鄉立幼兒園枋山分班,枋山鄉,公立,10,25000,0,2500,0,25000
屏東縣枋山鄉立幼兒園楓港分班,枋山鄉,公立,10,25000,0,2500,0,25000
屏東縣林邊非營利幼兒園(委託社團法人屏東縣宥薰教育協會辦理),林邊鄉,非營利,12,0,0,10028,0,120336
屏東縣歸來非營利幼兒園(委託社團法人東台灣幼兒教保專業促進協會辦理),屏東市,非營利,12,0,0,9436,0,113232
屏東縣泰武鄉佳平社區互助教保服務中心(泰武鄉佳平社區發展協會辦理),泰武鄉,私立,12,53448,0,4454,0,53448
屏東縣泰武鄉平和社區互助教保服務中心(泰武鄉平和社區發展協會辦理),泰武鄉,私立,12,46590,0,3883,0,46590
屏東縣泰武鄉泰武國民小學附設幼兒園,泰武鄉,公立,9,23350,0,2594,0,23350
屏東縣泰武鄉立幼兒園,泰武鄉,公立,11,25300,0,2300,0,25300
屏東縣海濱非營利幼兒園(委託社團法人高雄市碩苗社會教育關懷協會辦理),東港鎮,非營利,12,0,0,10880,0,130560
屏東縣海豐非營利幼兒園(委託社團法人中華幼兒教育改革研究會辦理),屏東市,非營利,12,0,0,9004,0,108048
屏東縣潮州鎮立幼兒園,潮州鎮,公立,11.5,36950,0,3213,0,36950
屏東縣牡丹鄉旭海社區互助教保服務中心(牡丹鄉旭海社區發展協會辦理),牡丹鄉,私立,12,58990,0,4916,0,58990
屏東縣牡丹鄉立幼兒園,牡丹鄉,公立,9,15800,0,1756,0,15800
屏東縣牡丹鄉立幼兒園牡丹分班,牡丹鄉,公立,9,15800,0,1756,0,15800
屏東縣牡丹鄉高士國民小學附設幼兒園,牡丹鄉,公立,9,27400,200,3044,22,27400
屏東縣牡丹鄉高士國民小學附設幼兒園牡林分班,牡丹鄉,公立,9,27400,200,3044,22,27400
屏東縣獅子鄉內獅國民小學附設幼兒園,獅子鄉,公立,9,23500,0,2611,0,23500
屏東縣獅子鄉立幼兒園,獅子鄉,公立,10,16900,0,1690,0,16900
屏東縣獅子鄉立幼兒園南世分班,獅子鄉,公立,10,16900,0,1690,0,16900
屏東縣獅子鄉立幼兒園楓林分班,獅子鄉,公立,10,16900,0,1690,0,16900
屏東縣獅子鄉立幼兒園草埔分班,獅子鄉,公立,10,16900,0,1690,0,16900
屏東縣琉球鄉立幼兒園,琉球鄉,公立,11,28500,0,2591,0,28500
屏東縣琉球鄉立幼兒園中福分班,琉球鄉,公立,11,28500,0,2591,0,28500
屏東縣琉球鄉立幼兒園南福分班,琉球鄉,公立,11,28500,0,2591,0,28500
屏東縣琉球鄉立幼兒園大福分班,琉球鄉,公立,11,28500,0,2591,0,28500
屏東縣琉球鄉立幼兒園本福分班,琉球鄉,公立,11,28500,0,2591,0,28500
屏東縣琉球鄉立幼兒園漁福分班,琉球鄉,公立,11,28500,0,2591,0,28500
屏東縣瑞光非營利幼兒園(委託財團法人福智文教基金會辦理),屏東市,非營利,12,0,0,9609,0,115308
屏東縣瑪家鄉佳義國民小學附設幼兒園,瑪家鄉,公立,9,22000,0,2444,0,22000
屏東縣瑪家鄉美園社區互助教保服務中心(瑪家鄉美園社區發展協會辦理),瑪家鄉,私立,12,42472,0,3539,0,42472
屏東縣社皮非營利幼兒園(委託社團法人台灣公共托育協會辦理),萬丹鄉,非營利,12,0,0,8578,0,102936
屏東縣社皮非營利幼兒園(委託社團法人台灣公共托育協會辦理)廣安分班,萬丹鄉,非營利,12,0,0,8578,0,102936
屏東縣私立三朋幼兒園,東港鎮,準公共化,12,118400,0,9867,0,118400
屏東縣私立上以唐幼兒園,屏東市,私立,12,110400,37800,9200,3150,110400
屏東縣私立上品幼兒園,萬丹鄉,準公共化,12,96436,9000,8036,750,96436
屏東縣私立中華兒童幼兒園,屏東市,準公共化,12,117856,30000,9821,2500,117856
屏東縣私立乙幼幼兒園,鹽埔鄉,準公共化,12,138684,9000,11557,750,138684
屏東縣私立九如幼兒園,九如鄉,私立,12,82000,0,6833,0,82000
屏東縣私立九如林肯幼兒園,九如鄉,私立,12,85000,0,7083,0,85000
屏東縣私立人之初幼兒園,長治鄉,準公共化,12,112260,4000,9355,333,112260
屏東縣私立仁和幼兒園,林邊鄉,準公共化,12,96816,0,8068,0,96816
屏東縣私立仁美幼兒園,鹽埔鄉,準公共化,12,99204,9000,8267,750,99204
屏東縣私立佳佳幼兒園,屏東市,準公共化,12,72000,9000,7500,750,90000
屏東縣私立佳育幼兒園,佳冬鄉,準公共化,12,94740,0,7895,0,94740
屏東縣私立依莎貝兒藝術幼兒園,枋寮鄉,準公共化,12,112752,0,9396,0,112752
屏東縣私立信華幼兒園,鹽埔鄉,準公共化,12,103572,9000,8631,750,103572
屏東縣私立傳說幼兒園,東港鎮,準公共化,12,86480,0,7207,0,86480
屏東縣私立內埔小博士幼兒園,內埔鄉,準公共化,12,122592,18000,10216,1500,122592
屏東縣私立冠迪幼兒園,長治鄉,準公共化,12,138444,19200,11537,1600,138444
屏東縣私立千葉幼兒園,屏東市,私立,12,261600,0,21800,0,261600
屏東縣私立原苗幼兒園,三地門鄉,準公共化,12,140028,14800,11669,1233,140028
屏東縣私立吉兒堡幼兒園,麟洛鄉,準公共化,12,112728,9000,9394,750,112728
屏東縣私立向日葵幼兒園,里港鄉,準公共化,12,130008,9000,10834,750,130008
屏東縣私立吳氏幼兒園,內埔鄉,準公共化,12,126000,9000,10500,750,126000
屏東縣私立啟航幼兒園,佳冬鄉,準公共化,12,84004,9000,7000,750,84004
屏東縣私立培正幼兒園,鹽埔鄉,準公共化,12,132396,24000,11033,2000,132396
屏東縣私立培華幼兒園,屏東市,準公共化,12,96164,30000,8014,2500,96164
屏東縣私立大同幼兒園,屏東市,私立,12,134400,24000,11200,2000,134400
屏東縣私立大老師幼兒園,內埔鄉,準公共化,12,101024,21600,8419,1800,101024
屏東縣私立天恩幼兒園,潮州鎮,準公共化,12,105836,9000,8820,750,105836
屏東縣私立威利幼兒園,屏東市,準公共化,12,125880,9000,10490,750,125880
屏東縣私立婦友幼兒園,屏東市,私立,12,78000,27600,6500,2300,78000
屏東縣私立學正幼兒園,屏東市,私立,12,107000,14400,8917,1200,107000
屏東縣私立安吉兒幼兒園,潮州鎮,準公共化,12,108680,9000,9057,750,108680
屏東縣私立宏靜幼兒園,萬丹鄉,準公共化,12,96008,0,8001,0,96008
屏東縣私立小哈佛幼兒園,屏東市,準公共化,12,109576,12000,9131,1000,109576
屏東縣私立小太陽幼兒園,高樹鄉,準公共化,12,125280,9000,10440,750,125280
屏東縣私立小樹苗幼兒園,屏東市,私立,12,97920,26400,8160,2200,97920
屏東縣私立小白花幼兒園,枋寮鄉,準公共化,12,84000,0,7000,0,84000
屏東縣私立屏東培正幼兒園,屏東市,準公共化,12,142332,24000,11861,2000,142332
屏東縣私立崇惠幼兒園,東港鎮,準公共化,12,105476,9000,8790,750,105476
屏東縣私立常春藤幼兒園,屏東市,私立,12,183600,0,15300,0,183600
屏東縣私立幼愛幼兒園,屏東市,準公共化,12,112424,0,9369,0,112424
屏東縣私立弘全幼兒園,南州鄉,準公共化,12,102552,12000,8546,1000,102552
屏東縣私立弘名幼兒園,潮州鎮,準公共化,12,114196,12000,9516,1000,114196
屏東縣私立復興幼兒園,長治鄉,準公共化,12,123600,0,10300,0,123600
屏東縣私立德生幼兒園,長治鄉,準公共化,12,96004,0,8000,0,96004
屏東縣私立心橋光幼兒園,萬丹鄉,準公共化,12,102188,12000,8516,1000,102188
屏東縣私立快樂寶貝幼兒園,屏東市,準公共化,12,120736,9000,10061,750,120736
屏東縣私立快樂小螞蟻幼兒園,潮州鎮,準公共化,12,120220,0,10018,0,120220
屏東縣私立快樂幼兒園,屏東市,準公共化,12,124020,9000,10335,750,124020
屏東縣私立怡光幼兒園,新園鄉,準公共化,12,100960,0,8413,0,100960
屏東縣私立恆春依莎貝兒藝術幼兒園,恆春鎮,準公共化,12,113844,6000,9487,500,113844
屏東縣私立愛彌兒幼兒園,屏東市,準公共化,12,106800,9000,8900,750,106800
屏東縣私立愛群幼兒園,枋寮鄉,準公共化,12,120000,9000,10000,750,120000
屏東縣私立慈育幼兒園,長治鄉,準公共化,12,86160,0,7180,0,86160
屏東縣私立慧橋幼兒園,恆春鎮,準公共化,12,100000,9000,8333,750,100000
屏東縣私立懷恩幼兒園,恆春鎮,私立,12,118000,1200,9833,100,118000
屏東縣私立摩根幼兒園,潮州鎮,私立,12,150000,0,12500,0,150000
屏東縣私立撒母耳幼兒園,萬巒鄉,準公共化,12,120000,0,10000,0,120000
屏東縣私立文化學苑幼兒園,屏東市,準公共化,12,93608,0,7801,0,93608
屏東縣私立新園欣欣幼兒園,新園鄉,私立,12,74580,3600,6215,300,74580
屏東縣私立新小天使幼兒園,林邊鄉,準公共化,12,96000,0,8000,0,96000
屏東縣私立日安幼兒園,東港鎮,準公共化,12,93600,0,7800,0,93600
屏東縣私立明星幼兒園,九如鄉,私立,12,80400,0,6700,0,80400
屏東縣私立明蕙幼兒園,萬丹鄉,私立,12,56100,0,4675,0,56100
屏東縣私立普林斯頓幼兒園,潮州鎮,準公共化,12,134968,79200,11247,6600,134968
屏東縣私立東港晴慧幼兒園,東港鎮,準公共化,12,100860,24000,8405,2000,100860
屏東縣私立枋寮楊老師幼兒園,枋寮鄉,準公共化,12,91200,0,7600,0,91200
屏東縣私立林邊文馨幼兒園,林邊鄉,準公共化,12,86480,0,7207,0,86480
屏東縣私立柏克萊幼兒園,屏東市,私立,12,93600,30000,7800,2500,93600
屏東縣私立欣欣幼兒園,內埔鄉,私立,12,96000,0,8000,0,96000
屏東縣私立正心幼兒園,屏東市,準公共化,12,96376,9000,8031,750,96376
屏東縣私立洛陽幼兒園,鹽埔鄉,私立,12,84000,0,7000,0,84000
屏東縣私立潮州晴慧幼兒園,潮州鎮,準公共化,12,124740,24000,10395,2000,124740
屏東縣私立狄仕耐幼兒園,鹽埔鄉,私立,12,129800,24000,10817,2000,129800
屏東縣私立瑪利幼兒園,恆春鎮,私立,12,72000,0,6000,0,72000
屏東縣私立福爾摩沙幼兒園,屏東市,私立,12,156000,0,13000,0,156000
屏東縣私立立群幼兒園,內埔鄉,準公共化,12,111336,9000,9278,750,111336
屏東縣私立立育幼兒園,萬丹鄉,準公共化,12,72460,0,7522,0,90268
屏東縣私立童年綠地幼兒園,潮州鎮,準公共化,12,112224,9000,9352,750,112224
屏東縣私立童心幼兒園,恆春鎮,準公共化,12,120312,9000,10026,750,120312
屏東縣私立米奇幼兒園,潮州鎮,準公共化,12,116228,24000,9686,2000,116228
屏東縣私立維多莉亞幼兒園,屏東市,準公共化,12,110704,9000,9225,750,110704
屏東縣私立美加幼兒園,屏東市,準公共化,12,149552,114000,12463,9500,149552
屏東縣私立美美幼兒園,新園鄉,私立,12,66000,0,5500,0,66000
屏東縣私立美金才藝幼兒園,屏東市,準公共化,12,153200,156000,12767,13000,153200
屏東縣私立群英幼兒園,林邊鄉,私立,12,56400,0,4700,0,56400
屏東縣私立耆老幼兒園,九如鄉,私立,12,41000,0,3417,0,41000
屏東縣私立聚英幼兒園,萬丹鄉,準公共化,12,87008,0,7251,0,87008
屏東縣私立育仁幼兒園,內埔鄉,私立,12,126000,0,10500,0,126000
屏東縣私立育光幼兒園,東港鎮,準公共化,12,123708,12000,10309,1000,123708
屏東縣私立育德幼兒園,新園鄉,準公共化,12,93608,0,7801,0,93608
屏東縣私立育才幼兒園,屏東市,準公共化,12,96000,9000,8000,750,96000
屏東縣私立育群幼兒園,枋寮鄉,準公共化,12,84000,0,7000,0,84000
屏東縣私立育英幼兒園,九如鄉,準公共化,12,111600,9000,9300,750,111600
屏東縣私立育輝幼兒園,東港鎮,準公共化,12,91200,9000,7600,750,91200
屏東縣私立艾樂芬幼兒園,屏東市,私立,12,98400,9000,8200,750,98400
屏東縣私立芊育幼兒園,鹽埔鄉,準公共化,12,119808,9000,9984,750,119808
屏東縣私立華山幼兒園,屏東市,準公共化,12,123088,9000,10257,750,123088
屏東縣私立萬丹培正幼兒園,萬丹鄉,準公共化,12,132684,24000,11057,2000,132684
屏東縣私立貝兒幼兒園,萬丹鄉,準公共化,12,110880,9000,9240,750,110880
屏東縣私立超聖幼兒園,佳冬鄉,準公共化,12,62400,0,6860,0,82320
屏東縣私立超越幼兒園,屏東市,準公共化,12,84004,0,7000,0,84004
屏東縣私立金博士幼兒園,新園鄉,準公共化,12,106908,9000,8909,750,106908
屏東縣私立隆安幼兒園,枋寮鄉,準公共化,12,122380,9000,10198,750,122380
屏東縣私立香潭幼兒園,長治鄉,準公共化,12,114504,9000,9542,750,114504
屏東縣私立鳳成幼兒園,高樹鄉,準公共化,12,79204,0,6600,0,79204
屏東縣私立龍幼幼兒園,屏東市,準公共化,12,123288,9000,10274,750,123288
屏東縣私立龍泉玫瑰幼兒園,內埔鄉,私立,12,92000,0,7667,0,92000
屏東縣私立龍華幼兒園,屏東市,準公共化,12,119864,9000,9989,750,119864
屏東縣竹田鄉立幼兒園,竹田鄉,公立,9,34700,0,3856,0,34700
屏東縣萬巒鄉立幼兒園,萬巒鄉,公立,12,22000,0,1833,0,22000
屏東縣萬巒鄉立幼兒園中興分班,萬巒鄉,公立,12,22000,0,1833,0,22000
屏東縣萬巒鄉立幼兒園五溝分班,萬巒鄉,公立,12,22000,0,1833,0,22000
屏東縣萬巒鄉立幼兒園佳和分班,萬巒鄉,公立,12,22000,0,1833,0,22000
屏東縣萬巒鄉立幼兒園成德分班,萬巒鄉,公立,12,22000,0,1833,0,22000
屏東縣萬巒鄉立幼兒園泗溝分班,萬巒鄉,公立,12,22000,0,1833,0,22000
屏東縣萬巒鄉赤山國民小學附設幼兒園,萬巒鄉,公立,9,29520,0,3280,0,29520
屏東縣霧臺鄉霧臺國民小學附設幼兒園,霧臺鄉,公立,9,21920,0,2436,0,21920
屏東縣霧臺鄉霧臺國民小學附設幼兒園霧臺分班,霧臺鄉,公立,9,21920,0,2436,0,21920
屏東縣高樹鄉立幼兒園,高樹鄉,公立,9,27000,0,3000,0,27000
屏榮學校財團法人屏東縣屏榮高級中學附設私立屏榮幼兒園,屏東市,準公共化,12,144840,9000,12070,750,144840
潮州鎮農會附設屏東縣私立潮農幼兒園,潮州鎮,準公共化,12,90604,9000,7550,750,90604
私立美和學校財團法人美和科技大學附設屏東縣美和幼兒園,內埔鄉,私立,12,77000,0,6417,0,77000
財團法人天主教會高雄教區附設屏東縣私立海星幼兒園,潮州鎮,私立,12,109200,0,9100,0,109200
財團法人天主教會高雄教區附設屏東縣私立玫瑰幼兒園,萬丹鄉,準公共化,12,90008,9000,7501,750,90008
財團法人天主教會高雄教區附設屏東縣私立聖家幼兒園,東港鎮,私立,12,86400,0,7200,0,86400
財團法人天主教玫瑰道明傳教修女會附設屏東縣私立道明幼兒園,屏東市,準公共化,12,117648,9000,9804,750,117648
財團法人屏東縣私立屏東友緣幼兒園,屏東市,準公共化,12,148680,9000,12390,750,148680
財團法人福智文教基金會附設屏東縣私立妙慧幼兒園,屏東市,準公共化,12,100848,0,8404,0,100848
